id	conversation_id	created_at	date	time	timezone	user_id	username	name	place	tweet	language	mentions	urls	photos	replies_count	retweets_count	likes_count	hashtags	cashtags	link	retweet	quote_url	video	thumbnail	near	geo	source	user_rt_id	user_rt	retweet_id	reply_to	retweet_date	translate	trans_src	trans_dest
1600027822340411392	1600027822340411392	2022-12-06 14:22:14 SE Asia Standard Time	2022-12-06	14:22:14	+0700	1599742784788889600	jaymejoseph14	JAYME JOSEPH		BREAKING NEWS – Sidang Pemeriksaan Saksi: Richard Eliezer, Kuat Ma'ruf dan Ricky Rizal  https://t.co/yPPf7oEwx4	in	[]	['https://newskhabri.site/breaking-news-sidang-pemeriksaan-saksi-richard-eliezer-kuat-maruf-dan-ricky-rizal/']	[]	0	0	0	[]	[]	https://twitter.com/JAYMEJOSEPH14/status/1600027822340411392	False		0								[]				
1600027809182793729	1600027809182793729	2022-12-06 14:22:11 SE Asia Standard Time	2022-12-06	14:22:11	+0700	1599741694559375368	sjerrifick	Sokhan Jerrifick		BREAKING NEWS – Sidang Pemeriksaan Saksi: Richard Eliezer, Kuat Ma'ruf dan Ricky Rizal  https://t.co/nigN5BT2Uz	in	[]	['https://newskhabri.site/breaking-news-sidang-pemeriksaan-saksi-richard-eliezer-kuat-maruf-dan-ricky-rizal/']	[]	0	0	0	[]	[]	https://twitter.com/SJerrifick/status/1600027809182793729	False		0								[]				
1600027798214774785	1600027798214774785	2022-12-06 14:22:08 SE Asia Standard Time	2022-12-06	14:22:08	+0700	1599740796323958784	burgerzsonava	Burgerz Sonava		BREAKING NEWS – Sidang Pemeriksaan Saksi: Richard Eliezer, Kuat Ma'ruf dan Ricky Rizal  https://t.co/40j4zXb0dC	in	[]	['https://newskhabri.site/breaking-news-sidang-pemeriksaan-saksi-richard-eliezer-kuat-maruf-dan-ricky-rizal/']	[]	0	0	0	[]	[]	https://twitter.com/BurgerzSonava/status/1600027798214774785	False		0								[]				
1600027789440303111	1600027789440303111	2022-12-06 14:22:06 SE Asia Standard Time	2022-12-06	14:22:06	+0700	1599738769900544000	kellyva26792535	Kelly Vargas		BREAKING NEWS – Sidang Pemeriksaan Saksi: Richard Eliezer, Kuat Ma'ruf dan Ricky Rizal  https://t.co/NkmXsuYIg8	in	[]	['https://newskhabri.site/breaking-news-sidang-pemeriksaan-saksi-richard-eliezer-kuat-maruf-dan-ricky-rizal/']	[]	0	0	0	[]	[]	https://twitter.com/KellyVa26792535/status/1600027789440303111	False		0								[]				
1600027781248811008	1600027781248811008	2022-12-06 14:22:04 SE Asia Standard Time	2022-12-06	14:22:04	+0700	1599735815260733441	tansaink	Tansain Khapar		BREAKING NEWS – Sidang Pemeriksaan Saksi: Richard Eliezer, Kuat Ma'ruf dan Ricky Rizal  https://t.co/KqHLRCrqMD	in	[]	['https://newskhabri.site/breaking-news-sidang-pemeriksaan-saksi-richard-eliezer-kuat-maruf-dan-ricky-rizal/']	[]	0	0	0	[]	[]	https://twitter.com/TansainK/status/1600027781248811008	False		0								[]				
1599997197214715905	1599997197214715905	2022-12-06 12:20:32 SE Asia Standard Time	2022-12-06	12:20:32	+0700	18129942	tempodotco	tempo.co		Majelis hakim menyindir terdakwa Kuat Ma’ruf dan Ricky Rizal, buta dan tuli karena kompak mengaku tidak tahu dan mendengar Ferdy Sambo menembak Yosua. #TempoNasional  https://t.co/HwTwSB7Yxr	in	[]	['https://nasional.tempo.co/read/1664920/begini-reaksi-hakim-saat-ricky-rizal-dan-kuat-maruf-kompak-tak-lihat-ferdy-sambo-tembak-yosua?utm_source=Twitter&utm_medium=Audev&utm_campaign=Nasional_O']	[]	1	3	3	['temponasional']	[]	https://twitter.com/tempodotco/status/1599997197214715905	False		0								[]				
1599989777096638464	1599989777096638464	2022-12-06 11:51:03 SE Asia Standard Time	2022-12-06	11:51:03	+0700	58880688	pikiran_rakyat	Pikiran Rakyat		Ungkap Kejadian di Magelang, Ricky Rizal Ceritakan Saat Kuat Ma’ruf Kejar Brigadir J Sambil Bawa Pisau  https://t.co/mQ1zZsuzo2  https://t.co/qjoyAg1X03	in	[]	['http://dlvr.it/SdvZWQ']	['https://pbs.twimg.com/media/FjROOTIaUAIKiHc.jpg']	0	0	0	[]	[]	https://twitter.com/pikiran_rakyat/status/1599989777096638464	False		1	https://pbs.twimg.com/media/FjROOTIaUAIKiHc.jpg							[]				
1599985167975997446	1599985167975997446	2022-12-06 11:32:44 SE Asia Standard Time	2022-12-06	11:32:44	+0700	115936810	tribunpontianak	Tribun Pontianak		Perhatian Richard Eliezer ke Kuat Ma’ruf, Ngasih Minuman Sebelum Meninggalkan Ruang Sidang  https://t.co/rTdz06h6yN  #Kuatmaruf #Ferdysambo #bharadae #richardeliezer #ferdysambo  Ricky Rizal  Bharada E  Ferdy Sambo  Putri Candrawathi  Ginting  Tara Basro  Fore Laksamana Maeda  https://t.co/WwkQRNhdgF	in	[]	['https://bit.ly/3F4SJbN']	['https://pbs.twimg.com/media/FjRKBVBUcAEKtnm.jpg']	0	0	0	['kuatmaruf', 'ferdysambo', 'bharadae', 'richardeliezer', 'ferdysambo']	[]	https://twitter.com/tribunpontianak/status/1599985167975997446	False		1	https://pbs.twimg.com/media/FjRKBVBUcAEKtnm.jpg							[]				
1599957564825153539	1599957564825153539	2022-12-06 09:43:03 SE Asia Standard Time	2022-12-06	09:43:03	+0700	1576197329626943488	de_liput	Kabar Nuswantara		Terungkap! Ricky Rizal dan Kuat Ma’ruf Dihadiahi Rp500 Juta, Richard Eliezer Rp1 Miliar | Liputan 6  https://t.co/c5piR59vPY	in	[]	['http://dlvr.it/SdvPLp']	[]	0	3	0	[]	[]	https://twitter.com/De_Liput/status/1599957564825153539	False		0								[]				
1599956943254491136	1599956943254491136	2022-12-06 09:40:35 SE Asia Standard Time	2022-12-06	09:40:35	+0700	23343960	kompascom	Kompas.com		Majelis hakim beberapa kali meragukan keterangan Bripka Ricky Rizal dan Kuat Ma'ruf dalam sidang di kasus pembunuhan Brigadir J.  https://t.co/P8k6lAahuV	in	[]	['http://dlvr.it/SdvP9c']	[]	0	0	2	[]	[]	https://twitter.com/kompascom/status/1599956943254491136	False		0								[]				
1599955875615186944	1599955875615186944	2022-12-06 09:36:21 SE Asia Standard Time	2022-12-06	09:36:21	+0700	69183155	detikcom	detikcom		Putri Candrawathi diagendakan akan bersaksi untuk untuk Bharada Richard Eliezer, Bripka Ricky Rizal dan Kuat Ma'ruf di sidang pembunuhan hari ini.  https://t.co/Xoqnz5cj3k	in	[]	[]	[]	0	5	24	[]	[]	https://twitter.com/detikcom/status/1599955875615186944	False		1	https://pbs.twimg.com/ext_tw_video_thumb/1599955816630697984/pu/img/jaqm-6pgfrrHE_j9.jpg							[]				
1599953240484970499	1599953240484970499	2022-12-06 09:25:52 SE Asia Standard Time	2022-12-06	09:25:52	+0700	69183155	detikcom	detikcom		Pernyataan Kuat Ma'ruf, Ricky Rizal, berbeda dengan Bharada E soal perintah Sambo di kasus pembunuhan Brigadir Yosua. Lantas bagaimana kesaksian Kuat dan Ricky?  https://t.co/Ub6bdNqri0	in	[]	['https://news.detik.com/berita/d-6444899/mencuat-beda-kuat-dan-ricky-dengan-eliezer-soal-tembak-atau-hajar-chad?utm_content=detikcom&utm_term=echobox&utm_medium=oa&utm_campaign=detikcomsocmed&utm_source=Twitter#Echobox=1670291417-1']	[]	1	0	3	[]	[]	https://twitter.com/detikcom/status/1599953240484970499	False		0								[]				
1599946248248692736	1599946248248692736	2022-12-06 08:58:05 SE Asia Standard Time	2022-12-06	08:58:05	+0700	4187275698	tirtoid	tirtoid		Hakim menyebut Kuat Ma'ruf dan Ricky Rizal buta dan tuli karena mengaku tidak melihat Ferdy Sambo menembak Brigadir Yosua.   https://t.co/7kyWRmFzyD	in	[]	['https://tirto.id/gzsP']	[]	0	7	28	[]	[]	https://twitter.com/TirtoID/status/1599946248248692736	False		0								[]				
1599936896784007170	1599936896784007170	2022-12-06 08:20:56 SE Asia Standard Time	2022-12-06	08:20:56	+0700	1572029518269022209	m_aminjebes	M Amin jebes		Kuat Ma'ruf &amp; Ricky Rizal anak-2ku kalian boleh berucap sejuta kebohongan kpd manusia yang diciptakan dari sesendok air hina, tetapi engkau membohongi Allah SWT dengan sumpahmu Demi Allah, maka insha Allah'hurabbi, kalian akan melihat apa akan terjadi di bagian tubu kalian...!!!?	in	[]	[]	[]	0	0	0	[]	[]	https://twitter.com/M_Aminjebes/status/1599936896784007170	False		0								[]				
1599929310932094977	1599929310932094977	2022-12-06 07:50:47 SE Asia Standard Time	2022-12-06	07:50:47	+0700	69183155	detikcom	detikcom		Ricky Rizal dan Kuat Ma'ruf saling bersaksi untuk Eliezer di sidang pembunuhan terhadap Brigadir Yosua. Hakim Ketua sempat geram dengan pengakuan keduanya.  https://t.co/bBw0glmRGM	in	[]	['https://news.detik.com/detiktv/d-6444829/pengakuan-ricky-rizal-kuat-maruf-yang-bikin-hakim-geram?utm_term=echoboxauto&utm_campaign=detikcomsocmed&utm_medium=oa&utm_content=detikcom&utm_source=Twitter#Echobox=1670283664']	[]	1	4	10	[]	[]	https://twitter.com/detikcom/status/1599929310932094977	False		0								[]				
1599926631753486336	1599926631753486336	2022-12-06 07:40:08 SE Asia Standard Time	2022-12-06	07:40:08	+0700	18129942	tempodotco	tempo.co		Begini Reaksi Hakim saat Ricky Rizal dan Kuat Ma'ruf Kompak Tak Lihat Ferdy Sambo Tembak Yosua  https://t.co/IEm7k3J9BO #TempoNasional	in	[]	['https://nasional.tempo.co/read/1664920/begini-reaksi-hakim-saat-ricky-rizal-dan-kuat-maruf-kompak-tak-lihat-ferdy-sambo-tembak-yosua?utm_source=Twitter&utm_medium=dlvr.it']	[]	1	0	1	['temponasional']	[]	https://twitter.com/tempodotco/status/1599926631753486336	False		0								[]				
1599924561998667776	1599924561998667776	2022-12-06 07:31:55 SE Asia Standard Time	2022-12-06	07:31:55	+0700	1462700902221967362	sejarahlokal	Lumbung Tanam		Menegangkan, Ricky Rizal Ungkap Kuat Ma'ruf Lari Lari Kejar Brigadir J Sambil Bawa Pisau Saat di Magelang  https://t.co/MmWUvjnRA8	in	[]	['https://www.orbitindonesia.com/nasional/pr-5445951837/menegangkan-ricky-rizal-ungkap-kuat-maruf-lari-lari-kejar-brigadir-j-sambil-bawa-pisau-saat-di-magelang']	[]	0	0	0	[]	[]	https://twitter.com/SejarahLokal/status/1599924561998667776	False		0								[]				
1599916533416955905	1599916533416955905	2022-12-06 07:00:01 SE Asia Standard Time	2022-12-06	07:00:01	+0700	2393930923	lensartv	Lensa Indonesia RTV		Terdakwa kasus pembunuhan berencana Brigadir J, Kuat Ma'ruf dan Ricky Rizal mengaku tak melihat saat Ferdy Sambo menembak. Kesaksian ini berbeda dengan yang diungkapkan Bharada E.   #pembunuhanberencana #brigadirj #kuatmaruf #rickyrizal #ferdysambo #bharadae #richardeliezer  https://t.co/9j49UyFaJI	in	[]	[]	[]	0	0	2	['pembunuhanberencana', 'brigadirj', 'kuatmaruf', 'rickyrizal', 'ferdysambo', 'bharadae', 'richardeliezer']	[]	https://twitter.com/lensaRTV/status/1599916533416955905	False		1	https://pbs.twimg.com/ext_tw_video_thumb/1599898851376103425/pu/img/QZ1FgyZNWKTln5Jq.jpg							[]				
1599909070819201025	1599909070819201025	2022-12-06 06:30:22 SE Asia Standard Time	2022-12-06	06:30:22	+0700	598959076	20detik	20DETIK		Pengakuan Ricky Rizal-Kuat Ma'ruf yang Bikin Hakim Geram  https://t.co/NNXVIOI6yd	in	[]	['https://20.detik.com/detikflash/20221206-221206046/pengakuan-ricky-rizal-kuat-maruf-yang-bikin-hakim-geram??utm_campaign=detikcomsocmed&utm_medium=oa&utm_source=twitter&utm_content=20detik']	[]	0	0	0	[]	[]	https://twitter.com/20detik/status/1599909070819201025	False		0								[]				
1599803903222104077	1599803903222104077	2022-12-05 23:32:28 SE Asia Standard Time	2022-12-05	23:32:28	+0700	255866913	hariankompas	Harian Kompas		Ketua Majelis Hakim kasus dugaan pembunuhan berencana Nofriansyah, Wahyu Iman Santosa, mengatakan, ada keanehan dari keterangan Kuat Ma'ruf yang menjadi saksi bagi terdakwa Ricky Rizal dan Richard Eliezer. #Polhuk #AdadiKompas   https://t.co/wjwO79QhyC	in	[]	['https://www.kompas.id/baca/polhuk/2022/12/05/hakim-cecar-kuat-soal-peristiwa-yang-dialami-putri-di-magelang?utm_source=medsos_twitter&utm_medium=link&utm_campaign=medsos_auto_polhuk']	[]	0	0	3	['polhuk', 'adadikompas']	[]	https://twitter.com/hariankompas/status/1599803903222104077	False		0								[]				
1599803901342908421	1599803901342908421	2022-12-05 23:32:27 SE Asia Standard Time	2022-12-05	23:32:27	+0700	771030588	kompasdata	Kompas Data		Ketua Majelis Hakim kasus dugaan pembunuhan berencana Nofriansyah, Wahyu Iman Santosa, mengatakan, ada keanehan dari keterangan Kuat Ma'ruf yang menjadi saksi bagi terdakwa Ricky Rizal dan Richard Eliezer. #Polhuk #AdadiKompas  https://t.co/WDip2o2M24	in	[]	['https://www.kompas.id/baca/polhuk/2022/12/05/hakim-cecar-kuat-soal-peristiwa-yang-dialami-putri-di-magelang?utm_source=medsos_twitter_kompasdata&utm_medium=link&utm_campaign=medsos_auto_polhuk']	[]	0	0	0	['polhuk', 'adadikompas']	[]	https://twitter.com/KompasData/status/1599803901342908421	False		0								[]				
1599802450781040640	1599802450781040640	2022-12-05 23:26:41 SE Asia Standard Time	2022-12-05	23:26:41	+0700	3331934354	riaunewsmedia	Riau News		Geram ke Jawaban Kuat Ma’ruf dan Ricky Sama: Kalian Sudah Merencanakan dari Awal - Riaunews  https://t.co/0wxF79T12O	in	[]	['https://riaunews.com/hukum-kriminal/geram-ke-jawaban-kuat-maruf-dan-ricky-sama-kalian-sudah-merencanakan-dari-awal/']	[]	0	0	0	[]	[]	https://twitter.com/riaunewsmedia/status/1599802450781040640	False		0								[]				
1599800778234789888	1599800778234789888	2022-12-05 23:20:03 SE Asia Standard Time	2022-12-05	23:20:03	+0700	1520998271161831424	tauberitamedia	tauberita		Putri Candrawathi diagendakan akan bersaksi untuk Richard Eliezer, Ricky Rizal hingga Kuat Ma'ruf di kasus pembunuhan Brigadir J. Sidang diagendakan pada Rabu.  https://t.co/zAkLmwti0D	in	[]	['https://www.tauberita.com/putri-candrawathi-akan-bersaksi-untuk-richard-rr-kuat-pada-rabu']	[]	0	0	0	[]	[]	https://twitter.com/tauberitamedia/status/1599800778234789888	False		0								[]				
1599797904583131137	1599797904583131137	2022-12-05 23:08:37 SE Asia Standard Time	2022-12-05	23:08:37	+0700	1592173966311174145	riaunewscom	Riau News		Geram ke Jawaban Kuat Ma’ruf dan Ricky Sama: Kalian Sudah Merencanakan dari Awal  https://t.co/LlppPIjvh2	in	[]	['https://riaunews.com/hukum-kriminal/geram-ke-jawaban-kuat-maruf-dan-ricky-sama-kalian-sudah-merencanakan-dari-awal/']	[]	0	0	0	[]	[]	https://twitter.com/RiauNewsCom/status/1599797904583131137	False		0								[]				
1599782154774675458	1599782154774675458	2022-12-05 22:06:02 SE Asia Standard Time	2022-12-05	22:06:02	+0700	1520998271161831424	tauberitamedia	tauberita		Ricky Rizal mengungkap bahwa terdakwa Kuat Ma’ruf sempat mengejar Brigadir J sambil membawa pisau saat berada di Magelang. -    https://t.co/gxeGOO16cD	in	[]	['https://www.tauberita.com/jawaban-brigadir-j-saat-ditanya-ricky-rizal-setelah-dikejar-kuat-maruf-yang-bawa-pisau']	[]	0	0	0	[]	[]	https://twitter.com/tauberitamedia/status/1599782154774675458	False		0								[]				
1599781898745573376	1599781898745573376	2022-12-05 22:05:01 SE Asia Standard Time	2022-12-05	22:05:01	+0700	1520998271161831424	tauberitamedia	tauberita		Ricky Rizal mengungkap bahwa terdakwa Kuat Ma’ruf sempat mengejar Brigadir J sambil membawa pisau saat berada di Magelang. -    https://t.co/gxeGONIWYv	in	[]	['https://www.tauberita.com/jawaban-brigadir-j-saat-ditanya-ricky-rizal-setelah-dikejar-kuat-maruf-yang-bawa-pisau']	[]	0	0	0	[]	[]	https://twitter.com/tauberitamedia/status/1599781898745573376	False		0								[]				
1599769538484133888	1599769538484133888	2022-12-05 21:15:54 SE Asia Standard Time	2022-12-05	21:15:54	+0700	69183155	detikcom	detikcom		Sehari usai pembunuhan Brigadir J, rupanya Ferdy Sambo sempat mengumpulkan Eliezer, Ricky dan Kuat Ma'ruf. Sambo bagikan ponsel sebagai tanda terima kasih.  https://t.co/1ceRWGpYiq	in	[]	['https://news.detik.com/berita/d-6444582/kuat-maruf-ungkap-diberi-sambo-iphone-13-pro-max-bapak-bilang-terima-kasih?utm_term=echoboxauto&utm_campaign=detikcomsocmed&utm_medium=oa&utm_content=detikcom&utm_source=Twitter#Echobox=1670249696']	[]	7	12	27	[]	[]	https://twitter.com/detikcom/status/1599769538484133888	False		0								[]				
1599768309322625026	1599768309322625026	2022-12-05 21:11:01 SE Asia Standard Time	2022-12-05	21:11:01	+0700	1520998271161831424	tauberitamedia	tauberita		Sehari usai pembunuhan Brigadir J, rupanya Ferdy Sambo sempat mengumpulkan Eliezer, Ricky dan Kuat Ma'ruf. Sambo bagikan ponsel sebagai tanda terima kasih.  https://t.co/Q7N0i0NXs6	in	[]	['https://www.tauberita.com/kuat-maruf-ungkap-diberi-sambo-iphone-13-pro-max-bapak-bilang-terima-kasih']	[]	0	0	0	[]	[]	https://twitter.com/tauberitamedia/status/1599768309322625026	False		0								[]				
1599768057945038848	1599768057945038848	2022-12-05 21:10:01 SE Asia Standard Time	2022-12-05	21:10:01	+0700	1520998271161831424	tauberitamedia	tauberita		Sehari usai pembunuhan Brigadir J, rupanya Ferdy Sambo sempat mengumpulkan Eliezer, Ricky dan Kuat Ma'ruf. Sambo bagikan ponsel sebagai tanda terima kasih.  https://t.co/Q7N0i0vOdY	in	[]	['https://www.tauberita.com/kuat-maruf-ungkap-diberi-sambo-iphone-13-pro-max-bapak-bilang-terima-kasih']	[]	0	0	0	[]	[]	https://twitter.com/tauberitamedia/status/1599768057945038848	False		0								[]				
1599766265643814913	1599766265643814913	2022-12-05 21:02:54 SE Asia Standard Time	2022-12-05	21:02:54	+0700	1334483117172670470	amelamalia2088	Amel (Amalia Dwi Septi)		Kuat Ma’ruf Sebut Tak Lihat Sambo Tembak Yosua, Hakim: Buta dan Tuli Kayak Ricky  https://t.co/eRwdQjRgS4 lewat @KanalnewsC #kuatmaruf #SidangFerdySambo #BrigadirYosua	in	[{'screen_name': 'kanalnewsc', 'name': 'kanalnews.co', 'id': '1523084209057038336'}]	['https://kanalnews.co/headline/kuat-maruf-sebut-tak-lihat-sambo-tembak-yosua-hakim-buat-dan-tuli-kayak-ricky/']	[]	1	0	1	['kuatmaruf', 'sidangferdysambo', 'brigadiryosua']	[]	https://twitter.com/amelamalia2088/status/1599766265643814913	False		0								[]				
1599758749237129217	1599758749237129217	2022-12-05 20:33:02 SE Asia Standard Time	2022-12-05	20:33:02	+0700	1419959939808722950	lagibeteajj	CaHRuweT		Jawaban menohok hakim kepada Ricky Rizal :“Sudah membunuh masih mencuri”  Ricky Rizal dan Kuat Ma'ruf ini nggak kalah biadabnya sama Sambo!  https://t.co/5WDy3sjSTd	in	[]	[]	[]	0	4	3	[]	[]	https://twitter.com/LagiBeTeAjj/status/1599758749237129217	False		1	https://pbs.twimg.com/ext_tw_video_thumb/1599758079826219009/pu/img/OURyy8FcXbgvoDgx.jpg							[]				
1599758027984605184	1599758027984605184	2022-12-05 20:30:10 SE Asia Standard Time	2022-12-05	20:30:10	+0700	388190238	idntimes	IDN Times		Kuat Ma’ruf dan Ricky Rizal Kompak Sebut Tak Lihat Sambo Tembak Yosua  https://t.co/9OPalbyS1u	in	[]	['https://www.idntimes.com/news/indonesia/irfanfathurohman/kuat-maruf-dan-ricky-rizal-kompak-sebut-tak-lihat-sambo-tembak-yosua?utm_source=twitter&utm_medium=twitter&utm_campaign=dlvr.it']	[]	0	1	0	[]	[]	https://twitter.com/IDNTimes/status/1599758027984605184	False		0								[]				
1599750990517108736	1599750990517108736	2022-12-05 20:02:12 SE Asia Standard Time	2022-12-05	20:02:12	+0700	1592354469093642241	bershalawatcom	Bershalawat		Sidang Kasus Sambo: Ricky Rizal Sebut Kuat Ma'ruf Sempat Bawa Pisau dan Kejar Brigadir J  https://t.co/MJFNDrvoqu	in	[]	['https://www.bershalawat.com/kriminal/pr-2965944745/sidang-kasus-sambo-ricky-rizal-sebut-kuat-maruf-sempat-bawa-pisau-dan-kejar-brigadir-j']	[]	0	0	0	[]	[]	https://twitter.com/Bershalawatcom/status/1599750990517108736	False		0								[]				
1599740936581697536	1599740936581697536	2022-12-05 19:22:15 SE Asia Standard Time	2022-12-05	19:22:15	+0700	759692754985242625	kumparan	kumparan		Ricky Rizal dan Kuat Ma'ruf kompak mengaku tidak melihat Sambo menembak Yosua. Berbeda dengan Richard Eliezer yang menyatakan sang jenderal menembak ajudannya tersebut. #kumparanNEWS #NewsUpdate  https://t.co/bSRFN8qCgm	in	[]	['https://kumparan.com/kumparannews/ricky-dan-kuat-kompak-ngaku-tak-lihat-sambo-tembak-yosua-hakim-tertawa-1zNiJHuOe3g?utm_source=Twitter&utm_medium=post&utm_campaign=int']	[]	1	4	14	['kumparannews', 'newsupdate']	[]	https://twitter.com/kumparan/status/1599740936581697536	False		0								[]				
1599738653752037380	1599738653752037380	2022-12-05 19:13:11 SE Asia Standard Time	2022-12-05	19:13:11	+0700	1158355819512991747	narasinewsroom	Narasi Newsroom		Kuat Ma’ruf menjalani sidang lanjutan sebagai saksi dengan terdakwa Bharada Richard Eliezer dan Bripka Ricky Rizal atas kasus pembunuhan Brigadir Yosua di Pengadilan Negeri Jakarta Selatan, Senin (5/12/2022).   | Narasi Daily  https://t.co/fooYViNlNk	in	[]	[]	[]	2	6	17	[]	[]	https://twitter.com/NarasiNewsroom/status/1599738653752037380	False		1	https://pbs.twimg.com/ext_tw_video_thumb/1599738522612953088/pu/img/_9QOlkksh2CQR8to.jpg							[]				
1599738376697294848	1599738376697294848	2022-12-05 19:12:05 SE Asia Standard Time	2022-12-05	19:12:05	+0700	55507370	tvonenews	tvOnenews		Ricky Rizal Cuek saat Kuat Ma'ruf Bawa Pisau Kejar Brigadir J, Tapi Sengaja Amankan Senpi  https://t.co/3GK5wbhP3a	in	[]	['http://dlvr.it/SdsV0F']	[]	0	0	1	[]	[]	https://twitter.com/tvOneNews/status/1599738376697294848	False		0								[]				
1599735872655880193	1599735872655880193	2022-12-05 19:02:08 SE Asia Standard Time	2022-12-05	19:02:08	+0700	375995332	officialinewstv	iNews		Terdakwa pembunuhan berencana Brigadri J, Ricky Rizal dan Kuat Ma'ruf memberikan kesaksian dalam persidangan Richard Eliezer. Ricky Rizal mencertakan beberapa peristiwa di Magelang. CIL   #iNews #iNewsSiang #RickyRizal #KuatMaruf #BharadaE #FerdySambo #Magelang #BrigadirJ  https://t.co/b75tMRMG4e	in	[]	[]	[]	0	0	0	['inews', 'inewssiang', 'rickyrizal', 'kuatmaruf', 'bharadae', 'ferdysambo', 'magelang', 'brigadirj']	[]	https://twitter.com/OfficialiNewsTV/status/1599735872655880193	False		1	https://pbs.twimg.com/media/FjNnSc_akAAbDBd.jpg							[]				
1599732614600216577	1599732614600216577	2022-12-05 18:49:11 SE Asia Standard Time	2022-12-05	18:49:11	+0700	1331398540858249218	21beritaterkini	Berita Terkini		Hakim Heran, Ricky Rizal Tak Berusaha Halangi Kuat Ma'ruf saat Mengejar Brigadir sambil Membawa Pisau  https://t.co/2lv4gIpY0l	in	[]	['https://www.grid.id/read/043601865/hakim-heran-ricky-rizal-tak-berusaha-halangi-kuat-maruf-saat-mengejar-brigadir-sambil-membawa-pisau?utm_source=dlvr.it&utm_medium=twitter']	[]	0	0	0	[]	[]	https://twitter.com/21BeritaTerkini/status/1599732614600216577	False		0								[]				
1599731424084434944	1599731424084434944	2022-12-05 18:44:27 SE Asia Standard Time	2022-12-05	18:44:27	+0700	2392460208	jawapos	Jawa Pos		Yosua Dikejar Kuat Ma'ruf Pakai Pisau, Hakim Bingung Ricky Rizal Diam  https://t.co/IYoJmqLXxj	in	[]	['https://www.jawapos.com/nasional/hukum-kriminal/05/12/2022/yosua-dikejar-kuat-maruf-pakai-pisau-hakim-bingung-ricky-rizal-diam/']	[]	0	0	1	[]	[]	https://twitter.com/jawapos/status/1599731424084434944	False		0								[]				
1599724795641618435	1599724795641618435	2022-12-05 18:18:07 SE Asia Standard Time	2022-12-05	18:18:07	+0700	155169715	soloposdotcom	Solopos		Cerita Ricky Rizal Lihat Kuat Ma’ruf Bawa Pisau Kejar Brigadir Yosua  https://t.co/TCnp2KVykI	in	[]	['https://www.solopos.com/cerita-ricky-rizal-lihat-kuat-maruf-bawa-pisau-kejar-brigadir-yosua-1490888?utm_source=dlvr.it&utm_medium=twitter']	[]	0	0	0	[]	[]	https://twitter.com/soloposdotcom/status/1599724795641618435	False		0								[]				
1599719501469483008	1599719501469483008	2022-12-05 17:57:05 SE Asia Standard Time	2022-12-05	17:57:05	+0700	902837643024539651	medcom_id	medcom_id		Ricky Rizal memberikan kesaksian di persidangan kasus pembunuhan berencana Brigadir J Senin, 5 Desember 2022. Ia mengatakan bahwa Kuat Ma'ruf sempat mengejar Brigadir J sambil membawa pisau saat di Magelang pada 7 Juli 2022  #MedcomID    https://t.co/XES4AOX0LB  https://t.co/JTqZb1BWeJ	in	[]	['https://www.medcom.id/nasional/hukum/VNnOmRjb-ricky-rizal-kuat-ma-ruf-kejar-brigadir-j-sambil-bawa-pisau']	['https://pbs.twimg.com/media/FjNYZClUYAAx0Ir.png']	0	0	0	['medcomid']	[]	https://twitter.com/medcom_id/status/1599719501469483008	False		1	https://pbs.twimg.com/media/FjNYZClUYAAx0Ir.png							[]				
1599701299783925761	1599701299783925761	2022-12-05 16:44:45 SE Asia Standard Time	2022-12-05	16:44:45	+0700	1430542109044477958	chatnews_id	Chatnews ID		Ricky Rizal mengatakan, Kuat Ma’ruf sempat mengejar Brigadir J sembari membawa pisau. #RickyRizal #KuatMaruf #ferdysambo #PutriCandrawathi #BrigadirJ #BrigadirYosua   https://t.co/plt38ixrR7	in	[]	['https://chatnews.id/read/ricky-rizal-kuat-maruf-bawa-pisau-dan-kejar-brigadir-j']	[]	0	0	0	['rickyrizal', 'kuatmaruf', 'ferdysambo', 'putricandrawathi', 'brigadirj', 'brigadiryosua']	[]	https://twitter.com/chatnews_id/status/1599701299783925761	False		0								[]				
1599700252344344576	1599700252344344576	2022-12-05 16:40:35 SE Asia Standard Time	2022-12-05	16:40:35	+0700	69183155	detikcom	detikcom		Ricky mengaku tidak tahu alasan Yosua satu mobil dengan dia. Sementara, Putri Candrawathi satu mobil dengan Richard Eliezer dan Kuat Ma'ruf saat menuju Jakarta.  https://t.co/mg7a4eu4if	in	[]	['https://news.detik.com/berita/d-6443786/hakim-heran-yosua-bertugas-kawal-pc-tapi-pisah-mobil-ke-jakarta?utm_content=detikcom&utm_term=echobox&utm_medium=oa&utm_campaign=detikcomsocmed&utm_source=Twitter#Echobox=1670230044-1']	[]	0	0	3	[]	[]	https://twitter.com/detikcom/status/1599700252344344576	False		0								[]				
1599694462720311296	1548906050262560768	2022-12-05 16:17:35 SE Asia Standard Time	2022-12-05	16:17:35	+0700	1303092621712273411	thedohidmedia	The DOH-ID Media		Bharada Richard Eliezer's legal counsel, Ronny Talapessy explained shortly of Ricky Rizal &amp; Kuat Ma'ruf changes in their pathway of BAP last 18 August, then followed the location of Sambo's residential house last 8 July while they're wearing black gloves.   https://t.co/jTG2WhFIe9	en	[]	[]	[]	1	0	0	[]	[]	https://twitter.com/TheDOHIDMedia/status/1599694462720311296	False		1	https://pbs.twimg.com/amplify_video_thumb/1599659721341837312/img/MXVrQbthstMSpKjO.jpg							[]				
1599694237863677954	1599694237863677954	2022-12-05 16:16:41 SE Asia Standard Time	2022-12-05	16:16:41	+0700	46693036	inilahdotcom	inilahcom		Ketua Majelis Hakim, Wahyu Iman Santoso bertanya dengan nada kesal kepada Ricky Rizal saat bersaksi untuk terdakwa Richard Eliezer dan Kuat Ma’ruf dalam sidang lanjutan kasus pembunuhan Brigadir J di Pengadilan Negeri Jakarta Selatan, Senin (5/12/2022).…  https://t.co/j320wHzaHa	in	[]	['https://www.inilah.com/sudah-disuruh-membunuh-ricky-masih-tega-curi-uang-brigadir-j?utm_source=dlvr.it&utm_medium=twitter']	[]	0	0	0	[]	[]	https://twitter.com/inilahdotcom/status/1599694237863677954	False		0								[]				
