id	conversation_id	created_at	date	time	timezone	user_id	username	name	place	tweet	language	mentions	urls	photos	replies_count	retweets_count	likes_count	hashtags	cashtags	link	retweet	quote_url	video	thumbnail	near	geo	source	user_rt_id	user_rt	retweet_id	reply_to	retweet_date	translate	trans_src	trans_dest
1602246575895764993	1602246575895764993	2022-12-12 17:18:46 SE Asia Standard Time	2022-12-12	17:18:46	+0700	46693036	inilahdotcom	inilahcom		Putri Candrawathi menangis setelah bersaksi dalam persidangan lanjutan terdakwa Richard Eliezer, Ricky Rizal dan Kuat Ma’ruf.  Menurut penasehat hukum Arman Hanis, Putri Candrawathi mengalami trauma.  https://t.co/RJAVr9zbjy	in	[]	[]	['https://pbs.twimg.com/media/FjxSxJ2aEAA3cpW.jpg']	0	2	5	[]	[]	https://twitter.com/inilahdotcom/status/1602246575895764993	False		1	https://pbs.twimg.com/media/FjxSxJ2aEAA3cpW.jpg							[]				
1602234254863106048	1602234254863106048	2022-12-12 16:29:49 SE Asia Standard Time	2022-12-12	16:29:49	+0700	3306771829	cnniddaily	CNN Indonesia Daily		Putri mengaku tak mengajak Kuat dan Ricky saat kembali ke Jakarta dari Magelang. Namun ternyata Kuat Ma’ruf lah yang mengemudikan mobil yang ditumpanginya.  https://t.co/ns6OyEyJew  https://t.co/FNA04p08d1	in	[]	['http://cnnindonesia.com/tv']	[]	0	1	0	[]	[]	https://twitter.com/CNNIDdaily/status/1602234254863106048	False		1	https://pbs.twimg.com/media/FjxHaLGUoAAI1Ab.jpg							[]				
1602223086257872897	1602223086257872897	2022-12-12 15:45:26 SE Asia Standard Time	2022-12-12	15:45:26	+0700	351999221	indosiar	Indosiar		Sidang pembunuhan berencana Brigadir Yosua kembali digelar. Putri Candrawathi akan dipertemukan dengan Eliezer, Kuat Ma'ruf dan Ricky di muka persidangan.  #IndosiarBerita   Berita lainnya:  https://t.co/wddAYjGQqE  https://t.co/e2rACVSIlS	in	[]	['https://bit.ly/3hLM5Ny']	[]	0	0	1	['indosiarberita']	[]	https://twitter.com/Indosiar/status/1602223086257872897	False		1	https://pbs.twimg.com/media/Fjw9TWgUYAEzM2-.jpg							[]				
1602197864695881735	1602197864695881735	2022-12-12 14:05:12 SE Asia Standard Time	2022-12-12	14:05:12	+0700	255866913	hariankompas	Harian Kompas		PN Jakarta Selatan menggelar sidang lanjutan terdakwa Richard Eliezer, Ricky Rizal, dan Kuat Ma'ruf atas kasus pembunuhan terhadap Brigadir J. Dalam sidang ini, JPU menghadirkan terdakwa Putri Candrawathi sebagai saksi. #Polhuk #AdadiKompas   https://t.co/jiKgnfuh7Z	in	[]	['https://www.kompas.id/baca/foto/2022/12/12/putri-candrawathi-jadi-saksi-sidang-bharada-e?utm_source=medsos_twitter&utm_medium=link&utm_campaign=medsos_auto_polhuk']	[]	0	1	0	['polhuk', 'adadikompas']	[]	https://twitter.com/hariankompas/status/1602197864695881735	False		0								[]				
1602197861990469632	1602197861990469632	2022-12-12 14:05:12 SE Asia Standard Time	2022-12-12	14:05:12	+0700	771030588	kompasdata	Kompas Data		PN Jakarta Selatan menggelar sidang lanjutan terdakwa Richard Eliezer, Ricky Rizal, dan Kuat Ma'ruf atas kasus pembunuhan terhadap Brigadir J. Dalam sidang ini, JPU menghadirkan terdakwa Putri Candrawathi sebagai saksi. #Polhuk #AdadiKompas  https://t.co/gqZR3v51ss	in	[]	['https://www.kompas.id/baca/foto/2022/12/12/putri-candrawathi-jadi-saksi-sidang-bharada-e?utm_source=medsos_twitter_kompasdata&utm_medium=link&utm_campaign=medsos_auto_polhuk']	[]	0	0	0	['polhuk', 'adadikompas']	[]	https://twitter.com/KompasData/status/1602197861990469632	False		0								[]				
1602192755522154496	1602192755522154496	2022-12-12 13:44:54 SE Asia Standard Time	2022-12-12	13:44:54	+0700	86923712	antarafoto	antarafoto.com		PUTRI CHANDRAWATHI BERSAKSI DALAM SIDANG PEMBUNUHAN YOSUA  Saksi kasus pembunuhan berencana Brigadir Yosua PC bersiap menjalani sidang lanjutan dengan terdakwa Richard Eliezer, Ricky Rizal dan Kuat Ma'ruf di PN Jaksel, Jakarta, Senin (12/12/2022).  ANTARA FOTO/Akbar Nugroho Gumay  https://t.co/GHCLpjj1tS	in	[]	[]	['https://pbs.twimg.com/media/Fjwh0TIacAAOYU2.jpg']	1	1	1	[]	[]	https://twitter.com/antarafoto/status/1602192755522154496	False		1	https://pbs.twimg.com/media/Fjwh0TIacAAOYU2.jpg							[]				
1602174332041502720	1602174332041502720	2022-12-12 12:31:42 SE Asia Standard Time	2022-12-12	12:31:42	+0700	71436318	kompastv	KOMPAS TV		BREAKING NEWS - Putri Candrawathi Jadi Saksi Sidang untuk Terdakwa Eliezer, Ricky, dan Kuat Ma'ruf  Streaming di  https://t.co/72Sghf29q0  https://t.co/0IU4qRM9lL	in	[]	['https://youtu.be/V4HCWRPCXx4']	['https://pbs.twimg.com/media/FjwRCqpUAAAJ0OM.jpg']	1	44	102	[]	[]	https://twitter.com/KompasTV/status/1602174332041502720	False		1	https://pbs.twimg.com/media/FjwRCqpUAAAJ0OM.jpg							[]				
1602171416644059137	1602171416644059137	2022-12-12 12:20:07 SE Asia Standard Time	2022-12-12	12:20:07	+0700	1576197329626943488	de_liput	Kabar Nuswantara		Putri Candrawathi Ceritakan Awal Kenal Ricky Rizal dan Kuat Ma'ruf  https://t.co/7tYVY6WfoM	in	[]	['http://dlvr.it/SfCdyJ']	[]	0	3	0	[]	[]	https://twitter.com/De_Liput/status/1602171416644059137	False		0								[]				
1602170902627913728	1602170902627913728	2022-12-12 12:18:04 SE Asia Standard Time	2022-12-12	12:18:04	+0700	388190238	idntimes	IDN Times		Putri Candrawathi akan menjadi saksi di sidang kasus pembunuhan berencana terhadap Nofriansyah Yosua Hutabatat, hari ini, Senin (12/12/2022). Istri Ferdy Sambo itu bakal memberikan keterangan untuk yakni Richard Eliezer, Ricky Rizal dan Kuat Ma’ruf.  https://t.co/CVl7XQ86iC  https://t.co/pM2MNXJoa7	in	[]	['http://bit.ly/3BtN3XI']	[]	0	0	1	[]	[]	https://twitter.com/IDNTimes/status/1602170902627913728	False		1	https://pbs.twimg.com/ext_tw_video_thumb/1602169448345243651/pu/img/oKQ1xiEtgRDLvQ9X.jpg							[]				
1602166525493919745	1602166525493919745	2022-12-12 12:00:41 SE Asia Standard Time	2022-12-12	12:00:41	+0700	69183155	detikcom	detikcom		Putri Candrawathi akan menjadi saksi di sidang kasus pembunuhan Brigadir Yosua Hutabarat hari ini. Putri akan bertemu dengan Richard Eliezer, Ricky Rizal dan Kuat Ma'ruf sebagai terdakwa.  https://t.co/E0pvDbHzqE	in	[]	[]	[]	0	1	7	[]	[]	https://twitter.com/detikcom/status/1602166525493919745	False		1	https://pbs.twimg.com/ext_tw_video_thumb/1602166444946604033/pu/img/jTA_bJw66jjhT7LD.jpg							[]				
1602161709413961728	1602161709413961728	2022-12-12 11:41:32 SE Asia Standard Time	2022-12-12	11:41:32	+0700	71436318	kompastv	KOMPAS TV		Masih Bertahan di Sisi Sambo, Ini Momen Ricky Rizal dan Kuat Ma'ruf Dicecar Hakim.  https://t.co/I2Jwv8mUJE	in	[]	['http://dlvr.it/SfCb3P']	[]	0	0	2	[]	[]	https://twitter.com/KompasTV/status/1602161709413961728	False		0								[]				
1602161699481591810	1602161699481591810	2022-12-12 11:41:30 SE Asia Standard Time	2022-12-12	11:41:30	+0700	69183155	detikcom	detikcom		#Foto Ricky Rizal dan Kuat Ma'ruf kembali hadir dalam sidang lanjutan perkara pembunuhan Brigadir Yosua. Kuat Ma'ruf tampak tertunduk saat tiba di PN Jaksel.  Foto: Grandyos Zafna/detikcom  https://t.co/FpdDz6kHHz	in	[]	[]	['https://pbs.twimg.com/media/FjwFkonXkAIMrzr.jpg', 'https://pbs.twimg.com/media/FjwFkuJXgAAqC9R.jpg', 'https://pbs.twimg.com/media/FjwFkzYXoAEmGIE.jpg']	0	0	3	['foto']	[]	https://twitter.com/detikcom/status/1602161699481591810	False		1	https://pbs.twimg.com/media/FjwFkonXkAIMrzr.jpg							[]				
1602155041296912385	1602155041296912385	2022-12-12 11:15:03 SE Asia Standard Time	2022-12-12	11:15:03	+0700	55507370	tvonenews	tvOnenews		Putri Candrawathi akan Bersaksi untuk Eliezer, Ricky Rizal dan Kuat Ma'ruf Hari Ini  https://t.co/z6rcRh2KNG	in	[]	['http://dlvr.it/SfCYTL']	[]	0	0	0	[]	[]	https://twitter.com/tvOneNews/status/1602155041296912385	False		0								[]				
1602149742234017794	1602149742234017794	2022-12-12 10:53:59 SE Asia Standard Time	2022-12-12	10:53:59	+0700	69183155	detikcom	detikcom		Istri Sambo, Putri Candrawathi, menjadi saksi di sidang pembunuhan Brigadir Yosua dengan terdakwa Bharada Richard Eliezer, Bripka Ricky Rizal, dan Kuat Ma'ruf.  https://t.co/w8iKuZyA53	in	[]	['https://news.detik.com/berita/d-6456491/istri-sambo-minta-sidang-tertutup-hakim-nyatakan-terbuka-kecuali-hal-asusila?utm_content=detikcom&utm_term=echobox&utm_medium=oa&utm_campaign=detikcomsocmed&utm_source=Twitter#Echobox=1670816429-1']	[]	0	0	4	[]	[]	https://twitter.com/detikcom/status/1602149742234017794	False		0								[]				
1602144528969916418	1602144528969916418	2022-12-12 10:33:16 SE Asia Standard Time	2022-12-12	10:33:16	+0700	1284414133845151745	rsaupwr	rsaupwr		Putri Candrawathi akan Bersaksi di Sidang Richard Eliezer, Kuat Ma'ruf, dan Ricky Rizal  https://t.co/cEBndwTZ3J	in	[]	['https://ift.tt/w2fTHDE']	[]	0	0	0	[]	[]	https://twitter.com/rsaupwr/status/1602144528969916418	False		0								[]				
1602142220693692423	1602142220693692423	2022-12-12 10:24:06 SE Asia Standard Time	2022-12-12	10:24:06	+0700	2393930923	lensartv	Lensa Indonesia RTV		Terdakwa kasus pembunuhan berencana Brigadir J, Putri Candrawathi, jadi saksi dalam sidang kasus yang sama untuk terdakwa Richard Eliezer atau Bharada E, Ricky Rizal, dan Kuat Ma'ruf, Senin (12/12).  #sidanglanjutan #bharadaeliezer #pembunuhan #brigadirj #putrichandrawathi  https://t.co/oC7ZHiB1Tl	in	[]	[]	[]	0	0	0	['sidanglanjutan', 'bharadaeliezer', 'pembunuhan', 'brigadirj', 'putrichandrawathi']	[]	https://twitter.com/lensaRTV/status/1602142220693692423	False		1	https://pbs.twimg.com/ext_tw_video_thumb/1602142080318722048/pu/img/kgvXMhAr5eTMtoYg.jpg							[]				
1602140740586733569	1602140740586733569	2022-12-12 10:18:13 SE Asia Standard Time	2022-12-12	10:18:13	+0700	46693036	inilahdotcom	inilahcom		Istri Ferdy Sambo, Putri Candrawathi yang juga terdakwa kasus pembunuhan Brigadir J atau Nofriansyah Yoshua Hutabarat akan duduk sebagai saksi untuk terdakwa Richard Eliezer, Ricky Rizal, dan Kuat Ma’ruf di Pengadilan Negeri Jakarta Selatan, Senin…  https://t.co/dcHo3eX8Q9	in	[]	['http://dlvr.it/SfCTqh']	[]	0	0	0	[]	[]	https://twitter.com/inilahdotcom/status/1602140740586733569	False		0								[]				
1602132848982777858	1602132848982777858	2022-12-12 09:46:52 SE Asia Standard Time	2022-12-12	09:46:52	+0700	121640063	radioelshinta	Radio Elshinta		Putri Candrawathi hari ini bersaksi dihadapan terdakwa Bharada E, Ricky Rizal dan Kuat Ma'ruf dalam persidangan di PN Jaksel terkait pembunuhan berencana Brigadir Yosua.  [TALK] Pakar Hukum Universitas Jenderal Soedirman (Unsoed), Prof Hibnu Nugroho  https://t.co/GmLwEuM5FX	in	[]	[]	['https://pbs.twimg.com/media/FjvrRlVaMAANAOS.jpg']	0	0	1	[]	[]	https://twitter.com/RadioElshinta/status/1602132848982777858	False		1	https://pbs.twimg.com/media/FjvrRlVaMAANAOS.jpg							[]				
1602124471909101568	1602123061884768256	2022-12-12 09:13:34 SE Asia Standard Time	2022-12-12	09:13:34	+0700	903229236051247104	eradotid	ERA.id		Disusul kedatangan Ricky Rizal dan Kuat Ma'ruf pada pukul 09.02 WIB.  https://t.co/7Kq59L1Rxk	in	[]	[]	[]	1	0	8	[]	[]	https://twitter.com/eradotid/status/1602124471909101568	False		1	https://pbs.twimg.com/ext_tw_video_thumb/1602124449272430592/pu/img/MtOyrZ2vPJZOlMXP.jpg							[]				
1602123061884768256	1602123061884768256	2022-12-12 09:07:58 SE Asia Standard Time	2022-12-12	09:07:58	+0700	903229236051247104	eradotid	ERA.id		Poin-poin penting dalam sidang lanjutan Bharada E, Ricky Rizal, dan Kuat Ma'ruf.  https://t.co/Jp7hFpjqN6	in	[]	[]	['https://pbs.twimg.com/media/FjvibxDaEAAiUvu.jpg']	1	13	105	[]	[]	https://twitter.com/eradotid/status/1602123061884768256	False		1	https://pbs.twimg.com/media/FjvibxDaEAAiUvu.jpg							[]				
1602118676958031872	1602118676958031872	2022-12-12 08:50:33 SE Asia Standard Time	2022-12-12	08:50:33	+0700	23343960	kompascom	Kompas.com		Dalam sidang hari ini, JPU akan menghadirkan terdakwa Putri Candrawathi sebagai saksi untuk Bharada E, Ricky Rizal, dan Kuat Ma'ruf. Berikut link-nya  https://t.co/YbTc7jyAwE	in	[]	['http://dlvr.it/SfCNcr']	[]	0	0	1	[]	[]	https://twitter.com/kompascom/status/1602118676958031872	False		0								[]				
1602112266736128002	1602112266736128002	2022-12-12 08:25:04 SE Asia Standard Time	2022-12-12	08:25:04	+0700	456426648	merdekadotcom	Merdeka.com		Putri Candrawathi akan Bersaksi di Sidang Bharada E, Ricky Rizal dan Kuat Ma'ruf  https://t.co/dGv0IWp74Q	in	[]	['http://dlvr.it/SfCM4f']	[]	0	0	0	[]	[]	https://twitter.com/merdekadotcom/status/1602112266736128002	False		0								[]				
1601758563298312192	1601758563298312192	2022-12-11 08:59:35 SE Asia Standard Time	2022-12-11	08:59:35	+0700	71436318	kompastv	KOMPAS TV		Ini Deretan Fakta Menarik saat Ferdy Sambo, Kuat Ma’ruf, dan Ricky Rizal Bersaksi di Persidangan  https://t.co/MSOi9nk1Oh	in	[]	['http://dlvr.it/Sf9Pb7']	[]	0	0	0	[]	[]	https://twitter.com/KompasTV/status/1601758563298312192	False		0								[]				
1601234652991209474	1601234652991209474	2022-12-09 22:17:45 SE Asia Standard Time	2022-12-09	22:17:45	+0700	1600087146056015873	janvisingh97	Janvi Singh		BREAKING NEWS – Ferdi Sambo Jadi Saksi Eliezer, Ricky, dan Kuat Ma'Ruf  https://t.co/73G8mogt5H	in	[]	['https://newskhabri.site/breaking-news-ferdi-sambo-jadi-saksi-eliezer-ricky-dan-kuat-maruf/']	[]	0	0	0	[]	[]	https://twitter.com/JanviSingh97/status/1601234652991209474	False		0								[]				
1601234565774950400	1601234565774950400	2022-12-09 22:17:24 SE Asia Standard Time	2022-12-09	22:17:24	+0700	1599742784788889600	jaymejoseph14	JAYME JOSEPH		BREAKING NEWS – Ferdi Sambo Jadi Saksi Eliezer, Ricky, dan Kuat Ma'Ruf  https://t.co/lTNzkUg0C9	in	[]	['https://newskhabri.site/breaking-news-ferdi-sambo-jadi-saksi-eliezer-ricky-dan-kuat-maruf/']	[]	0	0	0	[]	[]	https://twitter.com/JAYMEJOSEPH14/status/1601234565774950400	False		0								[]				
1601234549421363202	1601234549421363202	2022-12-09 22:17:20 SE Asia Standard Time	2022-12-09	22:17:20	+0700	1599741694559375368	sjerrifick	Sokhan Jerrifick		BREAKING NEWS – Ferdi Sambo Jadi Saksi Eliezer, Ricky, dan Kuat Ma'Ruf  https://t.co/f5VKH0qfIZ	in	[]	['https://newskhabri.site/breaking-news-ferdi-sambo-jadi-saksi-eliezer-ricky-dan-kuat-maruf/']	[]	0	0	0	[]	[]	https://twitter.com/SJerrifick/status/1601234549421363202	False		0								[]				
1601234535005536257	1601234535005536257	2022-12-09 22:17:17 SE Asia Standard Time	2022-12-09	22:17:17	+0700	1599740796323958784	burgerzsonava	Burgerz Sonava		BREAKING NEWS – Ferdi Sambo Jadi Saksi Eliezer, Ricky, dan Kuat Ma'Ruf  https://t.co/wXAHKGA6tI	in	[]	['https://newskhabri.site/breaking-news-ferdi-sambo-jadi-saksi-eliezer-ricky-dan-kuat-maruf/']	[]	0	0	0	[]	[]	https://twitter.com/BurgerzSonava/status/1601234535005536257	False		0								[]				
1601234520908480513	1601234520908480513	2022-12-09 22:17:13 SE Asia Standard Time	2022-12-09	22:17:13	+0700	1599738769900544000	kellyva26792535	Kelly Vargas		BREAKING NEWS – Ferdi Sambo Jadi Saksi Eliezer, Ricky, dan Kuat Ma'Ruf  https://t.co/WBxuKb6M84	in	[]	['https://newskhabri.site/breaking-news-ferdi-sambo-jadi-saksi-eliezer-ricky-dan-kuat-maruf/']	[]	0	0	0	[]	[]	https://twitter.com/KellyVa26792535/status/1601234520908480513	False		0								[]				
1601234504445829120	1601234504445829120	2022-12-09 22:17:10 SE Asia Standard Time	2022-12-09	22:17:10	+0700	1599735815260733441	tansaink	Tansain Khapar		BREAKING NEWS – Ferdi Sambo Jadi Saksi Eliezer, Ricky, dan Kuat Ma'Ruf  https://t.co/4UzJKWERaB	in	[]	['https://newskhabri.site/breaking-news-ferdi-sambo-jadi-saksi-eliezer-ricky-dan-kuat-maruf/']	[]	0	0	0	[]	[]	https://twitter.com/TansainK/status/1601234504445829120	False		0								[]				
1601223954328596483	1601223954328596483	2022-12-09 21:35:14 SE Asia Standard Time	2022-12-09	21:35:14	+0700	759692754985242625	kumparan	kumparan		Pengakuan itu terlontar dari mulut Ferdy Sambo dalam sidang konfrontir dengan Richard Eliezer, Ricky Rizal dan Kuat Ma'ruf, Rabu (7/12) lalu. #newsupdate #sidangsambo #news #newsflash  https://t.co/CeaEnyk8do	in	[]	['https://kumparan.com/kumparanvideo/ferdy-sambo-keceplosan-sebut-tembak-punggung-brigadir-yosua-1zPLWap8sI5?utm_source=Twitter&utm_medium=post&utm_campaign=int']	[]	0	1	1	['newsupdate', 'sidangsambo', 'news', 'newsflash']	[]	https://twitter.com/kumparan/status/1601223954328596483	False		0								[]				
1601190916660039686	1601190916660039686	2022-12-09 19:23:57 SE Asia Standard Time	2022-12-09	19:23:57	+0700	121412136	agibtanjung_	pak agib		kuat ma’ruf karo ricky rizal turune angler ora yo?	tl	[]	[]	[]	0	0	0	[]	[]	https://twitter.com/agibtanjung_/status/1601190916660039686	False		0								[]				
1601071106839937025	1601071106839937025	2022-12-09 11:27:52 SE Asia Standard Time	2022-12-09	11:27:52	+0700	1453173401342779395	heraldindo	Herald.id		Sore itu, Sambo memanggil tiga bawahannya. Masing-masing, Bharada Richard Eliezer, Bripka Ricky Rizal, dan Kuat Ma’ruf. #FerdySambo  https://t.co/wewn29esdN	in	[]	['https://herald.id/2022/12/09/usai-ibadah-sore-sambo-instruksikan-ini-ke-tiga-bawahannya-bikin-puluhan-polisi-terancam-kariernya/']	[]	0	0	0	['ferdysambo']	[]	https://twitter.com/heraldindo/status/1601071106839937025	False		0								[]				
1600994520753410048	1600994520753410048	2022-12-09 06:23:33 SE Asia Standard Time	2022-12-09	06:23:33	+0700	71436318	kompastv	KOMPAS TV		Romli Atmasasmita Ingatkan Ricky Rizal dan Kuat Ma'ruf: Ada Ancaman Hukum jika Beri Keterangan Palsu  https://t.co/cutFWLrofF	in	[]	['http://dlvr.it/Sf49gh']	[]	5	8	50	[]	[]	https://twitter.com/KompasTV/status/1600994520753410048	False		0								[]				
1600862795964518401	1600862795964518401	2022-12-08 21:40:07 SE Asia Standard Time	2022-12-08	21:40:07	+0700	55507370	tvonenews	tvOnenews		Bharada E, Ricky Rizal, dan Kuat Ma'ruf Batal Dapat Hadiah Besar, Ferdy Sambo: Keburu Kasusnya Terungkap  https://t.co/7kzanbRkuG	in	[]	['http://dlvr.it/Sf30XC']	[]	0	0	1	[]	[]	https://twitter.com/tvOneNews/status/1600862795964518401	False		0								[]				
1600739452220977154	1600739452220977154	2022-12-08 13:30:00 SE Asia Standard Time	2022-12-08	13:30:00	+0700	124171593	tribunnews	Tribunnews.com		Ricky Rizal dan Kuat Ma'ruf Kini Ditahan di Tempat Terpisah, Cegah Peluang Saling Berkomunikasi  https://t.co/4xM18WPuUl	in	[]	['https://www.tribunnews.com/nasional/2022/12/08/ricky-rizal-dan-kuat-maruf-kini-ditahan-di-tempat-terpisah-cegah-peluang-saling-berkomunikasi']	[]	0	0	2	[]	[]	https://twitter.com/tribunnews/status/1600739452220977154	False		0								[]				
1600737113913569282	1600016063907127299	2022-12-08 13:20:42 SE Asia Standard Time	2022-12-08	13:20:42	+0700	46693036	inilahdotcom	inilahcom		Selanjutnya Benny mengaku dalam kesaksiannya bahwa dirinya menginterogasi ketiga terdakwa (Richard, Ricky dan Kuat Ma'ruf).  Ricky Rizal dan Kuat Ma'ruf mengaku hanya mendengar suara tembakan didapur dan langsung meresponnya dengan tindakan tiarap.	in	[]	[]	[]	1	0	0	[]	[]	https://twitter.com/inilahdotcom/status/1600737113913569282	False		0								[]				
1600715660408934401	1600715660408934401	2022-12-08 11:55:27 SE Asia Standard Time	2022-12-08	11:55:27	+0700	902837643024539651	medcom_id	medcom_id		Majelis Hakim PN Jakarta Selatan memutuskan untuk memisahkan sel penahanan terdakwa Ricky Rizal dan Kuat Ma'ruf. Keduanya merupakan terdakwa kasus pembunuhan berencana terhadap Brigadir J  #MedcomID    https://t.co/yuFDo4sTHn via @medcom_id	in	[{'screen_name': 'medcom_id', 'name': 'medcom_id', 'id': '902837643024539651'}]	['https://medcom.id/s/8KyzWRzN?s_twitt']	[]	0	0	0	['medcomid']	[]	https://twitter.com/medcom_id/status/1600715660408934401	False		0								[]				
1600708384302387200	1600708384302387200	2022-12-08 11:26:33 SE Asia Standard Time	2022-12-08	11:26:33	+0700	1430542109044477958	chatnews_id	Chatnews ID		Ferdy Sambo membantah menjanjikan uang kepada terdakwa Richard Eliezer, terdakwa Ricky Rizal, dan terdakwa Kuat Ma’ruf. #FerdySambo #brigadirJ #BrigadirYosua #PutriCandrawathi #BharadaE    https://t.co/1SRCMV6RSM	in	[]	['https://chatnews.id/read/ferdy-sambo-bantah-janjikan-uang-ke-bharada-e-ricky-rizal-dan-kuat-maruf']	[]	0	0	0	['ferdysambo', 'brigadirj', 'brigadiryosua', 'putricandrawathi', 'bharadae']	[]	https://twitter.com/chatnews_id/status/1600708384302387200	False		0								[]				
1600707033962946561	1600707033962946561	2022-12-08 11:21:11 SE Asia Standard Time	2022-12-08	11:21:11	+0700	1012174601055449088	idsinpo	SINPO ID		Sambo Akui Berikan HP Baru Untuk Bharada E, Ricky Rizal, dan Kuat Ma'ruf  https://t.co/Bo8IZ0aw9r	in	[]	['https://sinpo.id/detail/42225/sambo-akui-berikan-hp-baru-untuk-bharada-e-ricky-rizal-dan-kuat-maruf']	[]	0	0	0	[]	[]	https://twitter.com/IdSinpo/status/1600707033962946561	False		0								[]				
1600652870570823680	1600652870570823680	2022-12-08 07:45:57 SE Asia Standard Time	2022-12-08	07:45:57	+0700	902837643024539651	medcom_id	medcom_id		Cegah Saling Berkomunikasi, Sel Ricky Rizal dan Kuat Ma'ruf Dipisah  https://t.co/9TVYc6UB7M	in	[]	['https://medcom.id/s/8KyzWRzN']	[]	0	0	0	[]	[]	https://twitter.com/medcom_id/status/1600652870570823680	False		0								[]				
1600629225710653444	1600629225710653444	2022-12-08 06:12:00 SE Asia Standard Time	2022-12-08	06:12:00	+0700	69183155	detikcom	detikcom		Ferdy Sambo menjadi saksi dalam sidang Richard Eliezer, Ricky Rizal, dan Kuat Ma'ruf. Berikut sejumlah pengakuan-pengakuan Ferdy Sambo di persidangan.  https://t.co/oyW5nzyZSX	in	[]	['https://news.detik.com/detiktv/d-6449143/pengakuan-sambo-dari-rencana-pembunuhan-hingga-bersih-bersih-cctv?utm_term=echoboxauto&utm_campaign=detikcomsocmed&utm_medium=oa&utm_content=detikcom&utm_source=Twitter#Echobox=1670454671']	[]	3	0	5	[]	[]	https://twitter.com/detikcom/status/1600629225710653444	False		0								[]				
1600627183130759170	1600627183130759170	2022-12-08 06:03:53 SE Asia Standard Time	2022-12-08	06:03:53	+0700	69183155	detikcom	detikcom		Ferdy Sambo menjadi saksi dalam sidang Richard Eliezer, Ricky Rizal, dan Kuat Ma'ruf. Berikut sejumlah pengakuan-pengakuan Ferdy Sambo di persidangan.  https://t.co/dVxq7jdoSf	in	[]	['https://news.detik.com/detiktv/d-6449143/pengakuan-sambo-awal-rencanakan-pembunuhan-hingga-bersih-bersih-cctv?utm_term=echoboxauto&utm_campaign=detikcomsocmed&utm_medium=oa&utm_content=detikcom&utm_source=Twitter#Echobox=1670454204']	[]	0	0	1	[]	[]	https://twitter.com/detikcom/status/1600627183130759170	False		0								[]				
1600567331192967168	1600567331192967168	2022-12-08 02:06:03 SE Asia Standard Time	2022-12-08	02:06:03	+0700	71436318	kompastv	KOMPAS TV		Kalimat 'Halus' Sambo saat Beri Hadiah Terima Kasih ke Richard Eliezer. Kuat Ma'ruf, dan Ricky Rizal  https://t.co/JCB7nMohKs	in	[]	['http://dlvr.it/Sf0g3S']	[]	0	0	0	[]	[]	https://twitter.com/KompasTV/status/1600567331192967168	False		0								[]				
1600503988130123781	1600503988130123781	2022-12-07 21:54:21 SE Asia Standard Time	2022-12-07	21:54:21	+0700	1062697782425772032	wjtodaycom	West Java Today		Pengajuan JPU Dikabulkan Hakim, Ricky Rizal dan Kuat Ma'ruf Kini Ditahan di Sel Terpisah  https://t.co/X2wcKmDLt9	in	[]	['https://ift.tt/XNOKRTf']	[]	0	0	0	[]	[]	https://twitter.com/wjtodaycom/status/1600503988130123781	False		0								[]				
1600497767574544386	1600497767574544386	2022-12-07 21:29:38 SE Asia Standard Time	2022-12-07	21:29:38	+0700	89877164	fajaronline	fajar online		Ricky Rizal dan Kuat Ma’ruf Dipisah Tahanan, Begini Pertimbangan Majelis Hakim  https://t.co/Q2Djyo0qm0 #BrigadirJ #FerdySambo #MajelisHakim #PNJakartaSelatan	in	[]	['https://fajar.co.id/2022/12/07/ricky-rizal-dan-kuat-maruf-dipisah-tahanan-begini-pertimbangan-majelis-hakim/']	[]	0	0	0	['brigadirj', 'ferdysambo', 'majelishakim', 'pnjakartaselatan']	[]	https://twitter.com/fajaronline/status/1600497767574544386	False		0								[]				
1600486798647783425	1600486798647783425	2022-12-07 20:46:03 SE Asia Standard Time	2022-12-07	20:46:03	+0700	2392460208	jawapos	Jawa Pos		Tak Satu Sel Dengan Kuat Ma'ruf, Ricky Rizal Dipindah ke Kejagung  https://t.co/0JaSPXIZgo	in	[]	['https://www.jawapos.com/nasional/hukum-kriminal/07/12/2022/tak-satu-sel-dengan-kuat-maruf-ricky-rizal-dipindah-ke-kejagung/']	[]	0	0	2	[]	[]	https://twitter.com/jawapos/status/1600486798647783425	False		0								[]				
1600484159348412416	1600484159348412416	2022-12-07 20:35:33 SE Asia Standard Time	2022-12-07	20:35:33	+0700	58880688	pikiran_rakyat	Pikiran Rakyat		Ferdy Sambo Ternyata Tidak Janjikan Uang ke Richard Eliezer, Ricky Rizal dan Kuat Ma'ruf, Lalu Apa?  https://t.co/ca7PQTV8vy  https://t.co/hwyoiNW0eN	in	[]	['http://dlvr.it/SdznjL']	['https://pbs.twimg.com/media/FjYP3JFaYAAy0-t.jpg']	0	1	0	[]	[]	https://twitter.com/pikiran_rakyat/status/1600484159348412416	False		1	https://pbs.twimg.com/media/FjYP3JFaYAAy0-t.jpg							[]				
1600481137494835200	1600481137494835200	2022-12-07 20:23:33 SE Asia Standard Time	2022-12-07	20:23:33	+0700	69183155	detikcom	detikcom		Hakim Ketua, Wahyu Iman Santoso mengeluarkan penetapan pemisahan ruang tahanan terhadap terdakwa Ricky Rizal dan Kuat Ma'ruf. Pemisahan ruangan sel tersebut bertujuan agar kedua terdakwa tak berkomunikasi satu sama lain.  https://t.co/Rq2bJb0k6m	in	[]	[]	[]	1	10	28	[]	[]	https://twitter.com/detikcom/status/1600481137494835200	False		1	https://pbs.twimg.com/ext_tw_video_thumb/1600481064396406786/pu/img/0jNudYT3T081Njc5.jpg							[]				
1600472371470561280	1600472371470561280	2022-12-07 19:48:43 SE Asia Standard Time	2022-12-07	19:48:43	+0700	89877164	fajaronline	fajar online		Ikut Skenario, Ini Janji Ferdy Sambo kepada Bharada E, Ricky Rizal dan Kuat Ma’ruf  https://t.co/dq8YWHyVn5 #BharadaE #BrigadirJ #FerdySambo #IkutSkenario	in	[]	['https://fajar.co.id/2022/12/07/ikut-skenario-ini-janji-ferdy-sambo-kepada-bharada-e-ricky-rizal-dan-kuat-maruf/']	[]	0	0	0	['bharadae', 'brigadirj', 'ferdysambo', 'ikutskenario']	[]	https://twitter.com/fajaronline/status/1600472371470561280	False		0								[]				
