id	conversation_id	created_at	date	time	timezone	user_id	username	name	place	tweet	language	mentions	urls	photos	replies_count	retweets_count	likes_count	hashtags	cashtags	link	retweet	quote_url	video	thumbnail	near	geo	source	user_rt_id	user_rt	retweet_id	reply_to	retweet_date	translate	trans_src	trans_dest
1589509505305706496	1589507476948652032	2022-11-07 13:46:12 SE Asia Standard Time	2022-11-07	13:46:12	+0700	46693036	inilahdotcom	inilahcom		Selain bakal bertemu Ricky Rizal dan Kuat Ma’ruf, Bharada E juga akan mendengarkan kesaksian 12 orang yang terdiri dari ART keluarga Ferdy Sambo, petugas provider telekomunikasi, petugas Bank, Nakes pemeriksa SWAB, hingga sopir ambulans yang antar jenazah Brigadir J ke RS Polri.	in	[]	[]	[]	1	0	0	[]	[]	https://twitter.com/inilahdotcom/status/1589509505305706496	False		0								[]				
1589509241064546304	1589507476948652032	2022-11-07 13:45:09 SE Asia Standard Time	2022-11-07	13:45:09	+0700	46693036	inilahdotcom	inilahcom		Terdakwa Bharada E menyatakan siap berhadapan dengan Ricky Rizal dan Kuat Ma’ruf dalam sidang lanjutan perkara pembunuhan Brigadir J di PN Jakarta Selatan, Senin (7/11/2022).   https://t.co/YkmDjKTLq3	in	[]	['https://www.inilah.com/sanggupi-bertemu-ricky-kuat-bharada-e-bakal-dengar-kesaksian-nakes-hingga-sopir-ambulans']	[]	1	0	0	[]	[]	https://twitter.com/inilahdotcom/status/1589509241064546304	False		0								[]				
1589509107937157122	1589509107937157122	2022-11-07 13:44:37 SE Asia Standard Time	2022-11-07	13:44:37	+0700	1521523308214190081	posbakumpranaja	POSBAKUM PRANAJA		Permohonan Bharada E Disidang Terpisah dengan Ricky Rizal dan Kuat Ma’ruf Ditolak Hakim  https://t.co/gPVf7jpDi5	in	[]	['https://pantau24jam.com/2022/11/07/permohonan-bharada-e-disidang-terpisah-dengan-ricky-rizal-dan-kuat-maruf-ditolak-hakim/']	[]	0	0	0	[]	[]	https://twitter.com/posbakumpranaja/status/1589509107937157122	False		0								[]				
1589509073292206080	1589509073292206080	2022-11-07 13:44:29 SE Asia Standard Time	2022-11-07	13:44:29	+0700	1349754689722617857	pantau24jam	Pantau24jam News		Permohonan Bharada E Disidang Terpisah dengan Ricky Rizal dan Kuat Ma’ruf Ditolak Hakim  https://t.co/ZcIFq5arAb	in	[]	['https://pantau24jam.com/2022/11/07/permohonan-bharada-e-disidang-terpisah-dengan-ricky-rizal-dan-kuat-maruf-ditolak-hakim/']	[]	0	0	0	[]	[]	https://twitter.com/pantau24jam/status/1589509073292206080	False		0								[]				
1589508952668372995	1589507476948652032	2022-11-07 13:44:00 SE Asia Standard Time	2022-11-07	13:44:00	+0700	46693036	inilahdotcom	inilahcom		Ketiga terdakwa yaitu Bharada E atau Richard Eliezer Pudihang Lumiu, Ricky Rizal, dan Kuat Ma’ruf akan menjalani sidang dengan agenda mendengarkan keterangan 12 orang saksi.   https://t.co/OFXNvM7HCa	in	[]	['https://www.inilah.com/bharada-e-disidang-bersama-ricky-rizal-dan-kuat-maruf-terkait-pembunuhan-brigadir-j']	[]	1	0	1	[]	[]	https://twitter.com/inilahdotcom/status/1589508952668372995	False		0								[]				
1589503051676913664	1589503051676913664	2022-11-07 13:20:33 SE Asia Standard Time	2022-11-07	13:20:33	+0700	18129942	tempodotco	tempo.co		Eliezer, Ricky Rizal dan Kuat Ma'ruf untuk Pertaman Kalinya Dipertemukan di Satu Ruang Sidang  https://t.co/tRdUaI1uYc #TempoFoto	in	[]	['https://foto.tempo.co/read/101530/eliezer-ricky-rizal-dan-kuat-maruf-untuk-pertaman-kalinya-dipertemukan-di-satu-ruang-sidang?utm_source=Twitter&utm_medium=Digital%20Marketing&utm_campaign=dlvrit']	[]	0	0	2	['tempofoto']	[]	https://twitter.com/tempodotco/status/1589503051676913664	False		0								[]				
1589502659672920065	1589502659672920065	2022-11-07 13:19:00 SE Asia Standard Time	2022-11-07	13:19:00	+0700	71436318	kompastv	KOMPAS TV		Inilah ekspresi 3 terdakwa Richard Eliezer, Kuat Ma'ruf, dan Ricky Rizal bertemu di persidangan pemeriksaan saksi pada Senin (7/11). Tampak mereka duduk bersama saat masuk di PN Jaksel. Sebelum akhirnya Ricky dan Kuat diminta keluar dan satu per satu masuk ke ruang persidangan.  https://t.co/BHYuo1ilTp	in	[]	[]	[]	1	4	19	[]	[]	https://twitter.com/KompasTV/status/1589502659672920065	False		1	https://pbs.twimg.com/amplify_video_thumb/1589481139445518336/img/pLXK3lyLK8wBp4MA.jpg							[]				
1589498633418084352	1589498633418084352	2022-11-07 13:03:00 SE Asia Standard Time	2022-11-07	13:03:00	+0700	1186946650595418116	voidotid	Voidotid		Sidang Bharada E ini direncanakan digabung dengan terdakwa lainnya yakni Ricky Rizal alias Bripka RR dan Kuat Ma'ruf alias KM   https://t.co/H23EdD1WuU  https://t.co/xtBhbrXUG3	in	[]	['https://voi.id/berita/225200/kuasa-hukum-kecewa-sidang-bharada-e-bakal-digabung-dengan-terdakwa-bripka-rr-dan-kuat-ma-ruf']	['https://pbs.twimg.com/media/Fg8IN8ZaEAEu7Vi.jpg']	1	1	5	[]	[]	https://twitter.com/voidotid/status/1589498633418084352	False		1	https://pbs.twimg.com/media/Fg8IN8ZaEAEu7Vi.jpg							[]				
1589497377076953089	1589497377076953089	2022-11-07 12:58:00 SE Asia Standard Time	2022-11-07	12:58:00	+0700	69183155	detikcom	detikcom		Bharada Eliezer, Bripka Ricky, dan Kuat Ma'ruf menjalani sidang lanjutan kasus pembunuhan berencana Brigadir J. Ini kali pertama mereka bertemu dalam sidang.  https://t.co/SiOL5BDVF9	in	[]	['https://news.detik.com/foto-news/d-6391884/momen-eliezer-kuat-maruf-dan-ricky-rizal-pertama-bertemu-di-sidang?utm_term=echobox&utm_campaign=detikcomsocmed&utm_medium=oa&utm_content=detikcom&utm_source=Twitter#Echobox=1667799557']	[]	0	1	2	[]	[]	https://twitter.com/detikcom/status/1589497377076953089	False		0								[]				
1589494739216338944	1589494739216338944	2022-11-07 12:47:31 SE Asia Standard Time	2022-11-07	12:47:31	+0700	69183155	detikcom	detikcom		#Foto Bharada Eliezer, Bripka Ricky, dan Kuat Ma'ruf menjalani sidang lanjutan kasus pembunuhan berencana Brigadir J. Ini kali pertama mereka bertemu dalam sidang.  Foto: Grandyos Zafna/detikcom  https://t.co/B0P39pEIal	in	[]	[]	['https://pbs.twimg.com/media/Fg8FCUzWAAELJwE.jpg', 'https://pbs.twimg.com/media/Fg8FCcrXwAECry9.jpg', 'https://pbs.twimg.com/media/Fg8FCi7WYAEG_of.jpg', 'https://pbs.twimg.com/media/Fg8FCpkX0AAChAc.jpg']	0	0	8	['foto']	[]	https://twitter.com/detikcom/status/1589494739216338944	False		1	https://pbs.twimg.com/media/Fg8FCUzWAAELJwE.jpg							[]				
1589489584886677504	1589489584886677504	2022-11-07 12:27:02 SE Asia Standard Time	2022-11-07	12:27:02	+0700	155169715	soloposdotcom	Solopos		Momen Terdakwa Bharada E, Kuat Ma’ruf dan Ricky Rizal Bertemu di Ruang Sidang  https://t.co/HoDEuDbm3N	in	[]	['https://www.solopos.com/momen-terdakwa-bharada-e-kuat-maruf-dan-ricky-rizal-bertemu-di-ruang-sidang-1465650?utm_source=dlvr.it&utm_medium=twitter']	[]	0	0	0	[]	[]	https://twitter.com/soloposdotcom/status/1589489584886677504	False		0								[]				
1589487505065144320	1589487505065144320	2022-11-07 12:18:47 SE Asia Standard Time	2022-11-07	12:18:47	+0700	944180887171743745	inewsdotid	iNews.id		Foto Richard Eliezer, Ricky Rizal dan Kuat Ma'ruf dalam Satu Ruang Sidang  https://t.co/ZfaAlU1JnE.  https://t.co/2I7KzE9weI	in	[]	['https://www.inews.id/multimedia/photo/foto-richard-eliezer-ricky-rizal-dan-kuat-maruf-dalam-satu-ruang-sidang/1/3']	['https://pbs.twimg.com/media/Fg7-dPqVsAAiCyc.jpg', 'https://pbs.twimg.com/media/Fg7-dP3VQAAWHn7.jpg', 'https://pbs.twimg.com/media/Fg7-dPyUoAEXvGC.jpg', 'https://pbs.twimg.com/media/Fg7-dPuVIAAB0fT.jpg']	0	0	1	[]	[]	https://twitter.com/inewsdotid/status/1589487505065144320	False		1	https://pbs.twimg.com/media/Fg7-dPqVsAAiCyc.jpg							[]				
1589485012054953985	1589485012054953985	2022-11-07 12:08:52 SE Asia Standard Time	2022-11-07	12:08:52	+0700	1349433464492236800	kartumerahnews	KARTUMERAH NEWS		Momen Bharada E Duduk Bersama Bripka Ricky Rizal dan Kuat Ma’ruf di Sidang Hari Ini  https://t.co/2XmJWfkmzQ	in	[]	['https://kartumerahnews.com/momen-bharada-e-duduk-bersama-bripka-ricky-rizal-dan-kuat-maruf-di-sidang-hari-ini/']	[]	0	0	0	[]	[]	https://twitter.com/KartumerahNews/status/1589485012054953985	False		0								[]				
1589481307066990592	1589481307066990592	2022-11-07 11:54:09 SE Asia Standard Time	2022-11-07	11:54:09	+0700	115936810	tribunpontianak	Tribun Pontianak		Momen Ricky Rizal Nyapa Richard Eliezer saat Bertemu di Ruang Sidang, Ekspresi Bharada E Jadi Sorotan!  https://t.co/MrqbkKaxaY  #bharadae #rickyrizal #kuatmaruf #putricandrawathi #ferdysambo  Kuat Ma'ruf  Ferdy Sambo Putri Candrawathi  https://t.co/Q4nCLM7AUs	in	[]	['https://bit.ly/3Ubgllp']	['https://pbs.twimg.com/media/Fg740UxUUAERD8x.jpg']	0	0	0	['bharadae', 'rickyrizal', 'kuatmaruf', 'putricandrawathi', 'ferdysambo']	[]	https://twitter.com/tribunpontianak/status/1589481307066990592	False		1	https://pbs.twimg.com/media/Fg740UxUUAERD8x.jpg							[]				
1589481229182722048	1589481229182722048	2022-11-07 11:53:50 SE Asia Standard Time	2022-11-07	11:53:50	+0700	69183155	detikcom	detikcom		Sidang lanjutan kasus pembunuhan Yosua kembali digelar dengan terdakwa Richard Eliezer, Ricky Rizal dan Kuat Ma'ruf. Sidang kali ini menghadirkan 12 saksi, namun baru 5 saksi yang hadir.  https://t.co/YYurcHa8gt	in	[]	[]	[]	0	2	7	[]	[]	https://twitter.com/detikcom/status/1589481229182722048	False		1	https://pbs.twimg.com/ext_tw_video_thumb/1589481171452403712/pu/img/KXJQEy7tXb2sswfF.jpg							[]				
1589478067906711552	1589478067906711552	2022-11-07 11:41:17 SE Asia Standard Time	2022-11-07	11:41:17	+0700	978482558567555072	roovofficial	ROOV ID		"Jangan sampai kelewatan update dari sidang Sambo hari ini!   Pada sidang ini, Pengadilan Negeri Jakarta Selatan akan menjalankan pemeriksaan saksi"" bersangkutan dengan menghadirkan Richard Eliezer Pudihang Lumiu, Ricky Rizal Wibowo &amp; Kuat Ma'ruf  KLIK 👉 https://t.co/Hc3kMMFRpK  https://t.co/JgCpca6k9q"	in	[]	['https://bit.ly/3Ua6R9P']	['https://pbs.twimg.com/media/Fg71DA7aAAAGRBs.jpg']	0	0	0	[]	[]	https://twitter.com/ROOVofficial/status/1589478067906711552	False		1	https://pbs.twimg.com/media/Fg71DA7aAAAGRBs.jpg							[]				
1589475835035131906	1589475835035131906	2022-11-07 11:32:24 SE Asia Standard Time	2022-11-07	11:32:24	+0700	1284414133845151745	rsaupwr	rsaupwr		Baru Lima Saksi Hadir di Sidang Richard Eliezer, Kuat Ma'ruf, dan Ricky Rizal  https://t.co/TS1348m3uS	in	[]	['https://ift.tt/JTDMLr5']	[]	0	0	0	[]	[]	https://twitter.com/rsaupwr/status/1589475835035131906	False		0								[]				
1589474733007212544	1589474733007212544	2022-11-07 11:28:02 SE Asia Standard Time	2022-11-07	11:28:02	+0700	202559038	gatra_com	GATRA.com		Punya Posisi Justice Collaborator, Pengacara Bharada E Harap Sidang Kliennya DIpisah Dari Ricky Rizal-Kuat Ma�ruf   https://t.co/ZT6myXnpyg	in	[]	['https://www.gatra.com/news-557242-hukum-punya-posisi-justice-collaborator-pengacara-bharada-e-harap-sidang-kliennya-dipisah-dari-ricky-rizal-kuat-maruf.html']	[]	0	0	0	[]	[]	https://twitter.com/GATRA_com/status/1589474733007212544	False		0								[]				
1589474294127595521	1589474294127595521	2022-11-07 11:26:17 SE Asia Standard Time	2022-11-07	11:26:17	+0700	69183155	detikcom	detikcom		Momentum Bharada Richard Eliezer bertemu Kuat Ma'ruf dan Bripka Ricky Rizal dalam sidang pemeriksaan saksi kasus pembunuhan Brigadir Yosua Hutabarat hari ini.  https://t.co/8dLpyUeeWe	in	[]	['https://news.detik.com/berita/d-6391604/momen-bharada-e-bertemu-kuat-maruf-dan-ricky-di-sidang-hari-ini?utm_content=detikcom&utm_term=echobox&utm_medium=oa&utm_campaign=detikcomsocmed&utm_source=Twitter#Echobox=1667792399-1']	[]	0	0	1	[]	[]	https://twitter.com/detikcom/status/1589474294127595521	False		0								[]				
1589471937473953793	1589471937473953793	2022-11-07 11:16:55 SE Asia Standard Time	2022-11-07	11:16:55	+0700	69183155	detikcom	detikcom		#Foto Hari ini sidang lanjutan kasus pembunuhan Yosua akan mempertemukan Richard Eliezer, Ricky Rizal, dan Kuat Ma'ruf. Ketiga terdakwa pun telah tiba di PN Jaksel.  Foto: Grandyos Zafna/detikcom  https://t.co/zIhfFSMDhb	in	[]	[]	['https://pbs.twimg.com/media/Fg7wTEUWYAEqszn.jpg', 'https://pbs.twimg.com/media/Fg7wTLeX0AA0yXF.jpg', 'https://pbs.twimg.com/media/Fg7wTTpXkAAdU69.jpg', 'https://pbs.twimg.com/media/Fg7wTbJWYAA84WG.jpg']	2	4	9	['foto']	[]	https://twitter.com/detikcom/status/1589471937473953793	False		1	https://pbs.twimg.com/media/Fg7wTEUWYAEqszn.jpg							[]				
1589470967377661953	1589470967377661953	2022-11-07 11:13:04 SE Asia Standard Time	2022-11-07	11:13:04	+0700	60490875	batampos	Batampos		Bharada E Sidang Bareng Ricky Rizal dan Kuat Ma’ruf, LPSK Tak Sepakat  https://t.co/y73QxxttLR	in	[]	['https://news.batampos.co.id/bharada-e-sidang-bareng-ricky-rizal-dan-kuat-maruf-lpsk-tak-sepakat/']	[]	0	0	0	[]	[]	https://twitter.com/BatamPos/status/1589470967377661953	False		0								[]				
1589470747663048704	1589470747663048704	2022-11-07 11:12:11 SE Asia Standard Time	2022-11-07	11:12:11	+0700	55507370	tvonenews	tvOnenews		Lanjutan sidang pembunuhan berencana terhadap Brigadir J kembali akan digelar dengan terdakwa Bharada E digabung dengan Ricky Rizal dan Kuat Ma'ruf.    Simak berita selengkapnya di  https://t.co/HzfoBgzCkw #HardNews_Hukum #NewsOne #CariBeritaditvOne  https://t.co/EUglYAvCIJ	in	[]	['https://bit.ly/3T6uvml']	['https://pbs.twimg.com/media/Fg7vEyxVQAAkyqi.jpg']	0	1	5	['hardnews_hukum', 'newsone', 'cariberitaditvone']	[]	https://twitter.com/tvOneNews/status/1589470747663048704	False		1	https://pbs.twimg.com/media/Fg7vEyxVQAAkyqi.jpg							[]				
1589469831379972096	1589469831379972096	2022-11-07 11:08:33 SE Asia Standard Time	2022-11-07	11:08:33	+0700	1476517260357365761	detik_jateng	Detik Jateng		Bharada E, Kuat Ma'ruf dan Ricky Rizal Pertama Bertemu di Sidang Hari Ini  https://t.co/37dKwtsHPu	in	[]	['https://www.detik.com/jateng/hukum-dan-kriminal/d-6391681/bharada-e-kuat-maruf-dan-ricky-rizal-pertama-bertemu-di-sidang-hari-ini?utm_campaign=cmssocmed&utm_medium=oa&utm_source=twitter&utm_content=detikjateng']	[]	0	0	0	[]	[]	https://twitter.com/detik_jateng/status/1589469831379972096	False		0								[]				
1589469653851836416	1589469653851836416	2022-11-07 11:07:51 SE Asia Standard Time	2022-11-07	11:07:51	+0700	115936810	tribunpontianak	Tribun Pontianak		Momen Ricky Rizal dan Kuat Ma’ruf Diminta Keluar Ruang Sidang di Persidangan Richard Eliezer  https://t.co/X4efoIIZEE  #rickyrizal #kuatmaruf #bharadae #richardeliezer #brigadirJ #ferdysambo #putricandrawathi  Ferdy Sambo  Putri Candrawathi  https://t.co/bpQYLBUeAP	in	[]	['https://bit.ly/3WvAh45']	['https://pbs.twimg.com/media/Fg7uN8hUAAQAYiL.jpg']	0	0	0	['rickyrizal', 'kuatmaruf', 'bharadae', 'richardeliezer', 'brigadirj', 'ferdysambo', 'putricandrawathi']	[]	https://twitter.com/tribunpontianak/status/1589469653851836416	False		1	https://pbs.twimg.com/media/Fg7uN8hUAAQAYiL.jpg							[]				
1589468459200819202	1589468459200819202	2022-11-07 11:03:06 SE Asia Standard Time	2022-11-07	11:03:06	+0700	18129942	tempodotco	tempo.co		Bharada E akan bertemu dengan dua koleganya saat menjadi ajudan Ferdy Sambo, yaitu Ricky Rizal dan Kuat Ma'ruf pada persidangan hari ini. #TempoNasional  https://t.co/GFRUBWp1Q4	in	[]	['https://nasional.tempo.co/read/1653957/bharada-e-siap-bertemu-kuat-maruf-dan-ricky-rizal-di-sidang-kasus-pembunuhan-brigadir-j-hari-ini?utm_source=Twitter&utm_medium=Audev&utm_campaign=Nasional_O']	[]	0	0	1	['temponasional']	[]	https://twitter.com/tempodotco/status/1589468459200819202	False		0								[]				
1589467711737937920	1589467711737937920	2022-11-07 11:00:08 SE Asia Standard Time	2022-11-07	11:00:08	+0700	1445252689546268675	forumterkini	Forumterkininews		Bharada E Digabung Bersama Ricky Rizal dan Kuat Ma’ruf dalam Sidang Hari Ini  https://t.co/tFFZmkSZ7N  https://t.co/r3gCuWp6al	in	[]	['https://ift.tt/CORv4V8']	['https://pbs.twimg.com/media/Fg7sdhbWAAIvPFc.jpg']	0	0	0	[]	[]	https://twitter.com/ForumTerkini/status/1589467711737937920	False		1	https://pbs.twimg.com/media/Fg7sdhbWAAIvPFc.jpg							[]				
1589466412740902913	1589466412740902913	2022-11-07 10:54:58 SE Asia Standard Time	2022-11-07	10:54:58	+0700	69183155	detikcom	detikcom		#Foto Hari ini sidang lanjutan kasus pembunuhan Yosua akan mempertemukan Richard Eliezer, Ricky Rizal, dan Kuat Ma'ruf. Ketiga terdakwa pun telah tiba di PN Jaksel. Berikut potretnya!  https://t.co/1uOjyxLc9n	in	[]	['https://news.detik.com/foto-news/d-6391523/richard-eliezer-ricky-rizal-dan-kuat-maruf-di-pn-jaksel?utm_content=detikcom&utm_term=echobox&utm_medium=oa&utm_campaign=detikcomsocmed&utm_source=Twitter#Echobox=1667789927-1']	[]	0	1	3	['foto']	[]	https://twitter.com/detikcom/status/1589466412740902913	False		0								[]				
1589465947760648194	1589465947760648194	2022-11-07 10:53:07 SE Asia Standard Time	2022-11-07	10:53:07	+0700	1478290633731162112	detik_sulsel	detik sulsel		Sebanyak 12 saksi akan dihadirkan dalam sidang lanjutan terdakwa Bharada Richard Eliezer, Ricky Rizal dan Kuat Ma'ruf terkait kasus pembunuhan Brigadir Yosua.  https://t.co/KZgXBbRdFW	in	[]	['https://www.detik.com/sulsel/berita/d-6391635/12-saksi-dihadirkan-di-sidang-lanjutan-eliezer-ricky-rizal-dan-kuat-maruf?utm_campaign=detikcomsocmed&utm_medium=oa&utm_source=twitter&utm_content=detiksulsel']	[]	0	0	0	[]	[]	https://twitter.com/detik_sulsel/status/1589465947760648194	False		0								[]				
1589465254056308736	1589465254056308736	2022-11-07 10:50:22 SE Asia Standard Time	2022-11-07	10:50:22	+0700	57261519	metro_tv	METRO TV		#BreakingNewsMetroTV Sidang Lanjutan pemeriksaan saksi terdakwa Richard Eliezer, Ricky Rizal, dan Kuat Ma'ruf   LIVE STREAMING:  Youtube:  https://t.co/bsDO6k69GT Website:  https://t.co/SOzNo2YhhU  #FerdySambo #SidangFerdySambo #KasusFerdySambo #BrigadirYosua #BrigadirJ  https://t.co/0R0IwHtejH	in	[]	['https://youtu.be/WkpxPTZ2BPw', 'http://metrotvnews.com/live']	['https://pbs.twimg.com/media/Fg7oOeOakAAyrb2.jpg']	1	0	3	['breakingnewsmetrotv', 'ferdysambo', 'sidangferdysambo', 'kasusferdysambo', 'brigadiryosua', 'brigadirj']	[]	https://twitter.com/Metro_TV/status/1589465254056308736	False		1	https://pbs.twimg.com/media/Fg7oOeOakAAyrb2.jpg							[]				
1589461230020071426	1589461230020071426	2022-11-07 10:34:22 SE Asia Standard Time	2022-11-07	10:34:22	+0700	527080951	urbanasiacom	Urbanasia		Humas PN Jaksel, Djuyamto menerangkan, pada hari ini, Senin (7/11/2022), PN Jaksel akan menggelar sidang untuk tiga terdakwa yaitu Richard Eliezer atau Bharada E, Ricky Rizal, dan Kuat Ma’ruf.    https://t.co/INF3sD906z	in	[]	['https://www.urbanasia.com/jadwal-dan-agenda-sidang-ferdy-sambo-dkk-pekan-ini-U66313']	[]	0	0	1	[]	[]	https://twitter.com/urbanasiacom/status/1589461230020071426	False		0								[]				
1589461149011316738	1589461149011316738	2022-11-07 10:34:03 SE Asia Standard Time	2022-11-07	10:34:03	+0700	71436318	kompastv	KOMPAS TV		Saksi-Saksi di Sidang Bharada E, Ricky Rizal, dan Kuat Ma’ruf Diambil Sumpahnya  https://t.co/BQBo3GazEl	in	[]	['http://dlvr.it/ScLSJs']	[]	1	1	2	[]	[]	https://twitter.com/KompasTV/status/1589461149011316738	False		0								[]				
1589460783833956354	1589460783833956354	2022-11-07 10:32:36 SE Asia Standard Time	2022-11-07	10:32:36	+0700	1284414133845151745	rsaupwr	rsaupwr		Bharada E Siap Bertemu Kuat Ma'ruf dan Ricky Rizal di Sidang Kasus Pembunuhan Brigadir J Hari Ini  https://t.co/CdCazs6fFV	in	[]	['https://ift.tt/CBHnZ5g']	[]	0	0	0	[]	[]	https://twitter.com/rsaupwr/status/1589460783833956354	False		0								[]				
1589459487995613184	1589459487995613184	2022-11-07 10:27:27 SE Asia Standard Time	2022-11-07	10:27:27	+0700	1415497133843570688	hallobantennews	Hallobantennews.com		LPSK Minta Sidang Bharada E Tak Digabung dengan Ricky Rizal dan Kuat Ma'ruf, Ini Alasannya  https://t.co/Og2Bymc7Pl	in	[]	['https://banten.hallo.id/politik-hukum/pr-565486967/lpsk-minta-sidang-bharada-e-tak-digabung-dengan-ricky-rizal-dan-kuat-maruf-ini-alasannya']	[]	0	0	0	[]	[]	https://twitter.com/hallobantennews/status/1589459487995613184	False		0								[]				
1589458663747747846	1589458663747747846	2022-11-07 10:24:10 SE Asia Standard Time	2022-11-07	10:24:10	+0700	46693036	inilahdotcom	inilahcom		Terdakwa Bharada E atau Richard Eliezer Pudihang Lumiu berhadapan dengan dua terdakwa lainnya yakni Ricky Rizal dan Kuat Ma’ruf saat menjalani sidang lanjutan kasus pembunuhan berencana Brigadir J atau Nofriansyah Yoshua Hutabarat di PN Jakarta Selatan,…  https://t.co/nODswQpmRQ	in	[]	['http://dlvr.it/ScLRh5']	[]	0	0	0	[]	[]	https://twitter.com/inilahdotcom/status/1589458663747747846	False		0								[]				
1589458648916709378	1589458648916709378	2022-11-07 10:24:07 SE Asia Standard Time	2022-11-07	10:24:07	+0700	46693036	inilahdotcom	inilahcom		Terdakwa Bharada E atau Richard Eliezer Pudihang Lumiu menyatakan siap berhadapan dengan Ricky Rizal dan Kuat Ma’ruf dalam sidang lanjutan perkara pembunuhan Brigadir J atau Nofriansyah Yoshua Hutabarat di PN Jakarta Selatan, Senin (7/11/2022). “Klien…  https://t.co/hIXPZCMGmL	in	[]	['http://dlvr.it/ScLRgk']	[]	0	0	0	[]	[]	https://twitter.com/inilahdotcom/status/1589458648916709378	False		0								[]				
1589458367688445952	1589458367688445952	2022-11-07 10:23:00 SE Asia Standard Time	2022-11-07	10:23:00	+0700	2714869507	newsmerahputih	newsmerahputih		Sidang lanjutan kasus pembunuhan berencana terhadap Yosua Hutabarat, akan digabungkan dengan Ricky Rizal dan Kuat Ma'ruf.  #merahputihcom #sidang #YosuaHutabarat #FerdySambo    https://t.co/f1voyO524G	in	[]	['https://merahputih.com/post/read/masuki-pekan-ke-4-sidang-richard-eliezer-ricky-rizal-dan-kuat-ma-ruf-digabung']	[]	0	0	0	['merahputihcom', 'sidang', 'yosuahutabarat', 'ferdysambo']	[]	https://twitter.com/newsmerahputih/status/1589458367688445952	False		0								[]				
1589454483612106753	1589454483612106753	2022-11-07 10:07:34 SE Asia Standard Time	2022-11-07	10:07:34	+0700	55507370	tvonenews	tvOnenews		Sedang Berlangung! Ini Link Live Streaming Sidang Bharada E Bertemu Ricky Rizal dan kuat Ma'ruf  https://t.co/K3zFWhSwsO	in	[]	['http://dlvr.it/ScLQWx']	[]	0	1	2	[]	[]	https://twitter.com/tvOneNews/status/1589454483612106753	False		0								[]				
1589454339159883777	1589454339159883777	2022-11-07 10:06:59 SE Asia Standard Time	2022-11-07	10:06:59	+0700	57261519	metro_tv	METRO TV		BREAKING NEWS - SIDANG FERDY SAMBO CS: RICKY RIZAL, RICHARD ELIEZER, KUAT MA’RUF DAN 12 SAKSI  https://t.co/QlegxpXmrt	in	[]	['https://twitter.com/i/broadcasts/1eaKbrDWgkZKX']	[]	3	4	11	[]	[]	https://twitter.com/Metro_TV/status/1589454339159883777	False		0								[]				
1589452881001857024	1589452881001857024	2022-11-07 10:01:12 SE Asia Standard Time	2022-11-07	10:01:12	+0700	69183155	detikcom	detikcom		Bharada Eliezer, Bripka Ricky Rizal dan Kuat Ma'ruf tiba di PN Jakarta Selatan. Ketiganya akan bertemu dalam sidang lanjutan kasus pembunuhan Yosua dengan agenda pemeriksaan saksi.  https://t.co/bIFhItvcK5	in	[]	[]	[]	0	0	8	[]	[]	https://twitter.com/detikcom/status/1589452881001857024	False		1	https://pbs.twimg.com/ext_tw_video_thumb/1589452795731738624/pu/img/cvHnLZUQIQA0pPcf.jpg							[]				
1589452436481056768	1589452436481056768	2022-11-07 09:59:26 SE Asia Standard Time	2022-11-07	09:59:26	+0700	1186946650595418116	voidotid	Voidotid		Sidang Bharada E ini direncanakan digabung dengan terdakwa lainnya yakni Ricky Rizal alias Bripka RR dan Kuat Ma'ruf alias KM.  https://t.co/H23EdDiZwU	in	[]	['https://voi.id/berita/225200/kuasa-hukum-kecewa-sidang-bharada-e-bakal-digabung-dengan-terdakwa-bripka-rr-dan-kuat-ma-ruf']	[]	0	0	0	[]	[]	https://twitter.com/voidotid/status/1589452436481056768	False		0								[]				
1589451036573728769	1589451036573728769	2022-11-07 09:53:52 SE Asia Standard Time	2022-11-07	09:53:52	+0700	1478290633731162112	detik_sulsel	detik sulsel		Sidang lanjutan hari ini, Richard Eliezer siap beertemu Kuat Ma'ruf dan Bripka Ricky RIzal.  https://t.co/nEmeHeBGe0	in	[]	['https://www.detik.com/sulsel/hukum-dan-kriminal/d-6391413/eliezer-siap-bertemu-kuat-maruf-ricky-rizal-di-sidang-kasus-yosua-hari-ini?utm_campaign=detikcomsocmed&utm_medium=oa&utm_source=twitter&utm_content=detiksulsel']	[]	0	0	0	[]	[]	https://twitter.com/detik_sulsel/status/1589451036573728769	False		0								[]				
1589450343523524608	1589450343523524608	2022-11-07 09:51:07 SE Asia Standard Time	2022-11-07	09:51:07	+0700	2811300588	indowarta1	indowarta.co		Bharada E Siap Berhadapan Langsung Dengan Ricky Rizal dan Kuat Ma’ruf  https://t.co/97ZuUTw7J4	in	[]	['https://koma.id/2022/11/07/46/bharada-e-siap-berhadapan-langsung-dengan-ricky-rizal-dan-kuat-maruf/']	[]	0	0	0	[]	[]	https://twitter.com/indowarta1/status/1589450343523524608	False		0								[]				
1589450339102629889	1589450339102629889	2022-11-07 09:51:06 SE Asia Standard Time	2022-11-07	09:51:06	+0700	2671854774	triomacan2000ba	triomacan 2000		Bharada E Siap Berhadapan Langsung Dengan Ricky Rizal dan Kuat Ma’ruf  https://t.co/moi1AHtjHj	in	[]	['https://koma.id/2022/11/07/46/bharada-e-siap-berhadapan-langsung-dengan-ricky-rizal-dan-kuat-maruf/']	[]	0	0	0	[]	[]	https://twitter.com/triomacan2000ba/status/1589450339102629889	False		0								[]				
1589450333859811328	1589450333859811328	2022-11-07 09:51:04 SE Asia Standard Time	2022-11-07	09:51:04	+0700	1533029520336228352	koma_id	KOMA INDONESIA		Bharada E Siap Berhadapan Langsung Dengan Ricky Rizal dan Kuat Ma’ruf  https://t.co/pHS5fxY8Xn	in	[]	['https://koma.id/2022/11/07/46/bharada-e-siap-berhadapan-langsung-dengan-ricky-rizal-dan-kuat-maruf/']	[]	0	0	0	[]	[]	https://twitter.com/koma_id/status/1589450333859811328	False		0								[]				
1589449083424768000	1589449083424768000	2022-11-07 09:46:06 SE Asia Standard Time	2022-11-07	09:46:06	+0700	71436318	kompastv	KOMPAS TV		Hari Ini Sidang Eliezer Digabung dengan Ricky Rizal dan Kuat Ma'ruf  https://t.co/IekoKO1Hff  https://t.co/eZCke8chQk	in	[]	['http://dlvr.it/ScLP66']	['https://pbs.twimg.com/media/Fg7bhHHaAAEniHH.jpg']	1	1	3	[]	[]	https://twitter.com/KompasTV/status/1589449083424768000	False		1	https://pbs.twimg.com/media/Fg7bhHHaAAEniHH.jpg							[]				
