id	conversation_id	created_at	date	time	timezone	user_id	username	name	place	tweet	language	mentions	urls	photos	replies_count	retweets_count	likes_count	hashtags	cashtags	link	retweet	quote_url	video	thumbnail	near	geo	source	user_rt_id	user_rt	retweet_id	reply_to	retweet_date	translate	trans_src	trans_dest
1588391896673849344	1588391896673849344	2022-11-04 11:45:13 SE Asia Standard Time	2022-11-04	11:45:13	+0700	115936810	tribunpontianak	Tribun Pontianak		Sosok Wanita Ini Ungkap Perbedaan Perlakuan saat Jadi Saksi Persidangan Ferdy Sambo dan Bharada e  https://t.co/tA4k39FZil  #ferdysambo #bharadae #PutriCandrawathi #brigadirJ  Reza Richard Eliezder Kuat Ma'ruf  Ricky Rizal Putri Candrawathi Susi  Vera Simanjuntak  https://t.co/hf2cKeTDfx	in	[]	['https://bit.ly/3hcPTt6']	['https://pbs.twimg.com/media/FgsaAdjUcAAw_n4.jpg']	0	0	1	['ferdysambo', 'bharadae', 'putricandrawathi', 'brigadirj']	[]	https://twitter.com/tribunpontianak/status/1588391896673849344	False		1	https://pbs.twimg.com/media/FgsaAdjUcAAw_n4.jpg							[]				
1588172744717320192	1588172744717320192	2022-11-03 21:14:23 SE Asia Standard Time	2022-11-03	21:14:23	+0700	46693036	inilahdotcom	inilahcom		Lanjutan sidang hari kedua minggu ketiga mengundang Ricky Rizal dan Kuat Ma’ruf untuk melakukan pemeriksaan saksi. Ruang sidang diisi dengan banyak drama dan air mata oleh masing-masing pihak.  #InilahViral #RickyRizal #KuatMaruf #BrigadirJ  #inilahcom #titiktengah #titikcerah  https://t.co/psgl4C6b7i	in	[]	[]	['https://pbs.twimg.com/media/FgpSD1yUUAAW-Me.jpg', 'https://pbs.twimg.com/media/FgpSFrgUAAERO6L.jpg', 'https://pbs.twimg.com/media/FgpSHOPUUAAoSlG.jpg']	1	1	1	['inilahviral', 'rickyrizal', 'kuatmaruf', 'brigadirj', 'inilahcom', 'titiktengah', 'titikcerah']	[]	https://twitter.com/inilahdotcom/status/1588172744717320192	False		1	https://pbs.twimg.com/media/FgpSD1yUUAAW-Me.jpg							[]				
1588134223491522561	1588134223491522561	2022-11-03 18:41:19 SE Asia Standard Time	2022-11-03	18:41:19	+0700	1349597148	jejakfaktacom	Jejak Fakta		Sidang lanjutan pembunuhan Brigadir Yosua Hutabarat atau Brigadir J mempertemukan terdakwa Kuat Ma’ruf dan Bripka Ricky Rizal dengan keluarga korban, Rabu (2/11/2022).   https://t.co/nqTjjIoTBo	in	[]	['https://jejakfakta.com/read/93/kuat-maruf-menangis-dihadapan-ibunda-brigadir-yosua']	[]	0	0	0	[]	[]	https://twitter.com/jejakfaktacom/status/1588134223491522561	False		0								[]				
1588091623346384898	1588091620062175232	2022-11-03 15:52:02 SE Asia Standard Time	2022-11-03	15:52:02	+0700	18129942	tempodotco	tempo.co		Selama persidangan, Ricky Rizal dan Kuat Ma'ruf menyampaikan penyesalan atas perbuatan yang dilakukan bersama Ferdy Sambo, Putri Candrawathi, dan Richard Eliezer.   Berikut empat fakta dalam persidangan kali ini:   https://t.co/ijyIHowbNl	in	[]	['https://nasional.tempo.co/read/1652508/4-fakta-persidangan-ricky-rizal-dan-kuat-maruf-permohonan-maaf-yang-terlambat-bantah-cekcok']	[]	1	0	0	[]	[]	https://twitter.com/tempodotco/status/1588091623346384898	False		0								[]				
1588091620062175232	1588091620062175232	2022-11-03 15:52:02 SE Asia Standard Time	2022-11-03	15:52:02	+0700	18129942	tempodotco	tempo.co		Ricky Rizal dan Kuat Ma’ruf menjalani sidang lanjutan pembunuhan berencana Yosua pada 2 November 2022.   Apa saja fakta yang terungkap?  #TempoThread  https://t.co/DJJSB1FYnN	in	[]	[]	['https://pbs.twimg.com/media/FgoIaOkUcAAuM3I.jpg']	1	1	4	['tempothread']	[]	https://twitter.com/tempodotco/status/1588091620062175232	False		1	https://pbs.twimg.com/media/FgoIaOkUcAAuM3I.jpg							[]				
1588029659354042370	1587033095815172096	2022-11-03 11:45:49 SE Asia Standard Time	2022-11-03	11:45:49	+0700	46693036	inilahdotcom	inilahcom		Keluarga Brigadir J, saat menjadi saksi dalam sidang lanjutan dengan terdakwa Ricky Rizal dan Kuat Ma’ruf di PN Jakarta Selatan, Rabu (2/11/2022).   Jaksa Penuntut Umum (JPU) menghadirkan 12 orang saksi kasus pembunuhan berencana terhadap Brigadir J.   https://t.co/w7yuXHGMvB	in	[]	['https://www.inilah.com/foto-momen-sidang-ricky-rizal-dan-kuat-maruf-hadirkan-saksi-keluarga-brigadir-j']	[]	1	0	0	[]	[]	https://twitter.com/inilahdotcom/status/1588029659354042370	False		0								[]				
1588024885653082112	1588024885653082112	2022-11-03 11:26:51 SE Asia Standard Time	2022-11-03	11:26:51	+0700	57261519	metro_tv	METRO TV		Kuat Ma'ruf dan Ricky Rizal menyampaikan bela sungkawa dan memohon maaf secara langsung kepada keluarga #BrigadirYosua. Ricky minta maaf atas kebodohannya dan Kuat bersumpah bahwa ia tidak ada niat melakukan tindakan yang didakwakan. #ferdysambo #sidangferdysambo #kasusferdysambo  https://t.co/IYyepWfJt7	in	[]	[]	[]	1	1	2	['brigadiryosua', 'ferdysambo', 'sidangferdysambo', 'kasusferdysambo']	[]	https://twitter.com/Metro_TV/status/1588024885653082112	False		1	https://pbs.twimg.com/amplify_video_thumb/1588024497718038528/img/htOW9nWlJtEEe9TG.jpg							[]				
1588023041237585921	1588023041237585921	2022-11-03 11:19:31 SE Asia Standard Time	2022-11-03	11:19:31	+0700	2340155395	suaradotcom	suaradotcom		Adik Brigadir J, Reza Hutabarat pun ikut dalam persidangan terdakwa Ricky Rizal dan Kuwat Ma'ruf.   https://t.co/dy8DaHNx39	in	[]	['https://www.suara.com/news/2022/11/03/111116/kronologi-perkenalan-adik-brigadir-j-dan-kuat-maruf-dipertanyakan-hakim-buat-temukan-titik-terang']	[]	0	0	0	[]	[]	https://twitter.com/suaradotcom/status/1588023041237585921	False		0								[]				
1588011521698717697	1588011521698717697	2022-11-03 10:33:45 SE Asia Standard Time	2022-11-03	10:33:45	+0700	2392460208	jawapos	Jawa Pos		Kuat Ma’ruf dan Ricky Rizal Minta Maaf, Ibu Yosua: Sungguh Hebat Skenario Kalian  https://t.co/8bDZBXY6J8	in	[]	['https://sumutpos.jawapos.com/hukum-kriminal/03/11/2022/kuat-maruf-dan-ricky-rizal-minta-maaf-ibu-yosua-sungguh-hebat-skenario-kalian/']	[]	0	0	1	[]	[]	https://twitter.com/jawapos/status/1588011521698717697	False		0								[]				
1588000629481275394	1588000629481275394	2022-11-03 09:50:28 SE Asia Standard Time	2022-11-03	09:50:28	+0700	174601238	sctv	SCTV		"Ibu Brigadir Yosua meluapkan emosinya saat menanggapi permintaan maaf terdakwa Kuat Ma'ruf dan Ricky Rizal: ""Sudah puaskah kalian dengan kematian anakku?"" #Liputan6SCTV  Berita lainnya:  https://t.co/qb6lW4Dqjd  https://t.co/glp5OFa2Ds"	in	[]	['https://bit.ly/3kmm1Xc']	[]	0	1	8	['liputan6sctv']	[]	https://twitter.com/SCTV/status/1588000629481275394	False		1	https://pbs.twimg.com/media/Fgm2IR2VEAAHVjF.jpg							[]				
1587983387712974850	1587983387712974850	2022-11-03 08:41:57 SE Asia Standard Time	2022-11-03	08:41:57	+0700	18129942	tempodotco	tempo.co		Ricky Rizal dan Kuat Ma'ruf menyampaikan penyesalan atas perbuatan yang mereka lakukan. Berikut empat fakta persidangan tersebut. #TempoNasional  https://t.co/aEQyJypDIe	in	[]	['https://nasional.tempo.co/read/1652508/4-fakta-persidangan-ricky-rizal-dan-kuat-maruf-permohonan-maaf-yang-terlambat-bantah-cekcok?utm_source=Twitter&utm_medium=Audev&utm_campaign=Nasional_Syahdi']	[]	0	0	0	['temponasional']	[]	https://twitter.com/tempodotco/status/1587983387712974850	False		0								[]				
1587971577555001346	1587971577555001346	2022-11-03 07:55:01 SE Asia Standard Time	2022-11-03	07:55:01	+0700	30617522	wartaekonomi	Warta Ekonomi		Ricky Rizal dan Kuat Ma'ruf Minta Maaf, Ibunda Brigadir J: Saya Gak Butuh!!  https://t.co/AWHIeJc2r1	in	[]	['https://wartaekonomi.co.id/read456563/ricky-rizal-dan-kuat-maruf-minta-maaf-ibunda-brigadir-j-saya-gak-butuh']	[]	0	0	0	[]	[]	https://twitter.com/WartaEkonomi/status/1587971577555001346	False		0								[]				
1587971098032762881	1587971098032762881	2022-11-03 07:53:07 SE Asia Standard Time	2022-11-03	07:53:07	+0700	1334454628541349890	chirping_magpie	Murai Berkicau🕊️		Coek, Jancoek, Jancoek...  Terdakwa Kuat Ma'ruf dan Ricky Rizal Wibowo alias Bripka RR dihadapkan dengan keluarga Brigadir J yg hadir sebagai saksi dlm persidangan di Pengadilan Negeri (PN) Jakswl, (2/11/2022).  Klik untuk lihat kontennya  https://t.co/W0tfcU3VZf  https://t.co/XLb2RnOVDM	in	[]	['https://s.helo-app.com/al/wrbrYQxhYR?c=tw']	[]	0	0	0	[]	[]	https://twitter.com/chirping_magpie/status/1587971098032762881	False		1	https://pbs.twimg.com/ext_tw_video_thumb/1587971061135470592/pu/img/aH9CgmGUnBlbuhkG.jpg							[]				
1587968693484818433	1587968693484818433	2022-11-03 07:43:34 SE Asia Standard Time	2022-11-03	07:43:34	+0700	23343960	kompascom	Kompas.com		Emosi Ibunda Brigadir J tak bisa dibendung saat hadir sebagai saksi dalam persidangan dengan terdakwa Ricky Rizal dan Kuat Ma'ruf.  https://t.co/C9iCfNAEfH	in	[]	['http://dlvr.it/Sc7gkj']	[]	0	0	0	[]	[]	https://twitter.com/kompascom/status/1587968693484818433	False		0								[]				
1587962647500263424	1587962647500263424	2022-11-03 07:19:32 SE Asia Standard Time	2022-11-03	07:19:32	+0700	69183155	detikcom	detikcom		Kuat Ma'ruf dan Bripka Ricky Rizal meminta maaf dihadapan keluarga Brigadir Yosua. Namun permintaan maaf tersebut dianggap oleh Ibu dari Yosua terlambat.  https://t.co/JYmQ46SvrX	in	[]	['https://news.detik.com/berita/d-6384867/permintaan-maaf-kuat-ke-orang-tua-yosua-dianggap-terlambat?utm_term=echoboxauto&utm_campaign=detikcomsocmed&utm_medium=oa&utm_content=detikcom&utm_source=Twitter#Echobox=1667434730']	[]	2	0	13	[]	[]	https://twitter.com/detikcom/status/1587962647500263424	False		0								[]				
1587962524049154049	1587962524049154049	2022-11-03 07:19:03 SE Asia Standard Time	2022-11-03	07:19:03	+0700	1520998271161831424	tauberitamedia	tauberita		Kuat Ma'ruf dan Bripka Ricky Rizal meminta maaf dihadapan keluarga Brigadir Yosua. Namun permintaan maaf tersebut dianggap oleh Ibu dari Yosua terlambat.  https://t.co/1tph6HhGL8	in	[]	['https://www.tauberita.com/permintaan-maaf-kuat-ke-orang-tua-yosua-dianggap-terlambat']	[]	0	0	0	[]	[]	https://twitter.com/tauberitamedia/status/1587962524049154049	False		0								[]				
1587962014789668864	1587962014789668864	2022-11-03 07:17:01 SE Asia Standard Time	2022-11-03	07:17:01	+0700	1520998271161831424	tauberitamedia	tauberita		Kuat Ma'ruf dan Bripka Ricky Rizal meminta maaf dihadapan keluarga Brigadir Yosua. Namun permintaan maaf tersebut dianggap oleh Ibu dari Yosua terlambat.  https://t.co/szBEH3FDsV	in	[]	['https://www.tauberita.com/permintaan-maaf-kuat-ke-orang-tua-yosua-dianggap-terlambat']	[]	0	0	0	[]	[]	https://twitter.com/tauberitamedia/status/1587962014789668864	False		0								[]				
1587961161730899968	1587961161730899968	2022-11-03 07:13:38 SE Asia Standard Time	2022-11-03	07:13:38	+0700	60005078	oke_zone	Oke Zone		Dengarkan Kesaksian Ibu Yosua yang Penuh Amarah, Kuat Maruf Menangis Keluarga Yosua kembali menjadi saksi dalam persidangan bagi Ricky Rizal dan Kuat Ma'ruf. Dalam kesaksiannya, Rosti ...  https://t.co/DSkS8BhfTZ	in	[]	['https://www.youtube.com/watch?v=XKNoeRAN1RU']	[]	0	0	0	[]	[]	https://twitter.com/oke_zone/status/1587961161730899968	False		0								[]				
1587961160044871682	1587961160044871682	2022-11-03 07:13:38 SE Asia Standard Time	2022-11-03	07:13:38	+0700	60005078	oke_zone	Oke Zone		Ayah Brigadir J Minta Kuat Ma'ruf dan Ricky Rizal Tatap Matanya saat Sidang, Ada Apa? Ayah Brigadir J, Samuel Hutabarat tidak kuasa menahan emosinya saat berbicara kepada Kuat Ma'ruf dan Ricky Rizal.  https://t.co/iFVECSdAFm	in	[]	['https://www.youtube.com/watch?v=xrU-EGff-Hs']	[]	0	0	0	[]	[]	https://twitter.com/oke_zone/status/1587961160044871682	False		0								[]				
1587941135397584896	1587941135397584896	2022-11-03 05:54:03 SE Asia Standard Time	2022-11-03	05:54:03	+0700	18129942	tempodotco	tempo.co		4 Fakta Persidangan Ricky Rizal dan Kuat Ma'ruf: Permohonan Maaf yang Terlambat, Bantah Cekcok  https://t.co/4gzvOPXtjz #TempoNasional	in	[]	['https://nasional.tempo.co/read/1652508/4-fakta-persidangan-ricky-rizal-dan-kuat-maruf-permohonan-maaf-yang-terlambat-bantah-cekcok?utm_source=Twitter&utm_medium=Digital%20Marketing&utm_campaign=dlvrit']	[]	0	0	0	['temponasional']	[]	https://twitter.com/tempodotco/status/1587941135397584896	False		0								[]				
1587918743619141633	1587918743619141633	2022-11-03 04:25:05 SE Asia Standard Time	2022-11-03	04:25:05	+0700	79130206	jpnncom	JPNN.com		Ibunda Brigadri J, Rosti Simanjuntak menolak permintaan maaf dari Ricky Rizal dan Kuat Ma'ruf. #RostiSimanjuntak  https://t.co/CGmEhY6EWM	in	[]	['https://kalsel.jpnn.com/kriminal/513/ini-alasan-ibunda-brigadir-j-tolak-permintaan-maaf-kuat-maruf-dan-ricky']	[]	0	0	0	['rostisimanjuntak']	[]	https://twitter.com/jpnncom/status/1587918743619141633	False		0								[]				
1587877580925202432	1587877580925202432	2022-11-03 01:41:31 SE Asia Standard Time	2022-11-03	01:41:31	+0700	1559415005510258688	newsnetwork2022	News Network		Found on YouTube: BREAKING NEWS - Sidang Kasus Sambo, Agenda Pemeriksaan Saksi Ricky Rizal dan Kuat Ma'Ruf  https://t.co/9HRBsKbFHE  https://t.co/32uzNPPR6C	in	[]	['http://nnewz2022.blogspot.com/2022/11/found-on-youtube-breaking-news-sidang.html', 'https://ifttt.com/images/no_image_card.png']	[]	0	0	0	[]	[]	https://twitter.com/Newsnetwork2022/status/1587877580925202432	False		0								[]				
1587865128757649408	1587865128757649408	2022-11-03 00:52:02 SE Asia Standard Time	2022-11-03	00:52:02	+0700	79130206	jpnncom	JPNN.com		Rosti Simanjuntak selaku ibunda Brigadir J menolak permintaan maaf dari Kuat Ma'ruf dan Bripka Ricky Rizal. #RostiSimanjuntak  https://t.co/0VnTGaWZPh	in	[]	['https://m.jpnn.com/news/ibunda-brigadir-j-tolak-permintaan-maaf-kuat-maruf-dan-ricky-lalu-menyebut-tuhan']	[]	0	0	0	['rostisimanjuntak']	[]	https://twitter.com/jpnncom/status/1587865128757649408	False		0								[]				
1587857134683033600	1587857134683033600	2022-11-03 00:20:16 SE Asia Standard Time	2022-11-03	00:20:16	+0700	46693036	inilahdotcom	inilahcom		Keluarga Brigadir Nopriansyah Yosua Hutabarat atau Brigadir J, saat menjadi saksi dalam sidang lanjutan dengan terdakwa Ricky Rizal dan Kuat Ma’ruf di PN Jakarta Selatan, Rabu (2/11/2022). Dalam sidang hari ini, Jaksa Penuntut Umum (JPU) menghadirkan 12…  https://t.co/c0ramslfUs	in	[]	['http://dlvr.it/Sc6ns5']	[]	0	0	0	[]	[]	https://twitter.com/inilahdotcom/status/1587857134683033600	False		0								[]				
1587826376132136960	1587826376132136960	2022-11-02 22:18:03 SE Asia Standard Time	2022-11-02	22:18:03	+0700	79130206	jpnncom	JPNN.com		Ibunda Brigadir Nofriansyah Yosua Hutabarat alias Brigadir J, Rosti Simanjuntak meminta Kuat Ma'ruf dan Ricky Rizal membuktikan permintaan maaf kepada Tuhan. #IbundaBrigadirJ  https://t.co/E1ptYqhBWB	in	[]	['https://m.jpnn.com/news/ibunda-brigadir-j-buktikan-kata-maafmu-itu-di-hadapan-tuhan']	[]	0	0	0	['ibundabrigadirj']	[]	https://twitter.com/jpnncom/status/1587826376132136960	False		0								[]				
1587818808248397831	1587818808248397831	2022-11-02 21:47:58 SE Asia Standard Time	2022-11-02	21:47:58	+0700	1499728604384481282	news_delik	delik.news		Berikut Ucapan Lengkap Ibu Brigadir J di Hadapan Kuat Ma'ruf dan Ricky Rizal -  https://t.co/Oj8DtCx8XS  https://t.co/Qpsoxm49kk	in	[]	['http://delik.news', 'https://delik.news/berikut-ucapan-lengkap-ibu-brigadir-j-di-hadapan-kuat-maruf-dan-ricky-rizal/']	[]	0	0	1	[]	[]	https://twitter.com/news_delik/status/1587818808248397831	False		0								[]				
1587809765547442176	1587809765547442176	2022-11-02 21:12:02 SE Asia Standard Time	2022-11-02	21:12:02	+0700	1435237343598948354	aboutmalangcom	AboutMalang.com #UsutTuntas		Amarah Ibu Brigadir J Meluap Saat Hadiri Persidangan Kuat Ma'ruf dan Ricky Rizal: Berikan Kami Keadilan!  https://t.co/hZMKkqTSRi	in	[]	['http://dlvr.it/Sc6HPh']	[]	0	0	0	[]	[]	https://twitter.com/aboutmalangcom/status/1587809765547442176	False		0								[]				
1587807932091371521	1587807932091371521	2022-11-02 21:04:45 SE Asia Standard Time	2022-11-02	21:04:45	+0700	1267107442065694722	bebasbaru	bebasbaru_official		Kena mental semua, kecuali Ferdy Sambo yang tetap kepedean!!  Rosti Simanjuntak Tuding Kuat Ma&amp;rsquo;ruf dan Ricky Rizal Tahu Skenario Jahat Sambo, Tapi Sengaja Melakukan Ini!  https://t.co/nwt6vuL9rU	in	[]	['https://www.bebasbaru.com/headline/pr-2025433134/rosti-simanjuntak-tuding-kuat-maruf-dan-ricky-rizal-tahu-skenario-jahat-sambo-tapi-sengaja-melakukan-ini']	[]	0	0	1	[]	[]	https://twitter.com/bebasbaru/status/1587807932091371521	False		0								[]				
1587805518399434753	1587805518399434753	2022-11-02 20:55:10 SE Asia Standard Time	2022-11-02	20:55:10	+0700	150867974	bajajkt	Bajaj Jakarta		Tak Kuat Menahan Tangis #shorts #brigadirj #ferdysambo #kuatmaruf #ricky...  https://t.co/tqLLbGIpn6 lewat @YouTube   Kuat Ma'ruf Susi Bharada E Ferdy Sambo Putri Candrawathi	in	[{'screen_name': 'youtube', 'name': 'youtube', 'id': '10228272'}]	['https://youtube.com/shorts/v4C796EiOz8?feature=share']	[]	0	0	0	['shorts', 'brigadirj', 'ferdysambo', 'kuatmaruf', 'ricky']	[]	https://twitter.com/bajajkt/status/1587805518399434753	False		0								[]				
1587802997257818113	1587802997257818113	2022-11-02 20:45:09 SE Asia Standard Time	2022-11-02	20:45:09	+0700	759692754985242625	kumparan	kumparan		Ricky Rizal meminta maaf, sedang Kuat Ma’ruf turut berbelasungkawa sekaligus bersumpah tidak pernah berencana.  https://t.co/MxuHpNVxAr	in	[]	['https://kumparan.com/kumparanvideo/ricky-rizal-minta-maaf-kuat-maruf-bersumpah-tidak-pernah-berencana-bunuh-yosua-1zAgwH0nP4X?utm_source=Twitter&utm_medium=post&utm_campaign=int']	[]	0	0	0	[]	[]	https://twitter.com/kumparan/status/1587802997257818113	False		0								[]				
1587801403174813696	1587801403174813696	2022-11-02 20:38:49 SE Asia Standard Time	2022-11-02	20:38:49	+0700	2711608536	begayepontianak	Begaye Pontianak		Sama Dengan Ferdy Sambo, Hakim Hadirkan 12 Saksi Untuk Kuat Ma'ruf Dan Ricky Rizal  https://t.co/sFSwYVPhvY	in	[]	['https://www.begayepontianak.com/nasional/pr-6845432126/sama-dengan-ferdy-sambo-hakim-hadirkan-12-saksi-untuk-kuat-maruf-dan-ricky-rizal']	[]	0	0	0	[]	[]	https://twitter.com/BegayePontianak/status/1587801403174813696	False		0								[]				
1587799821402124288	1587799821402124288	2022-11-02 20:32:31 SE Asia Standard Time	2022-11-02	20:32:31	+0700	1225432911899324419	repelitao	Repelita Online		Minta Kuat Ma'ruf dan Ricky Rizal Tak Ikuti Skenario Sambo, Ayah Brigadir J: Kalau Terbawa, Kalian Akan Termakan Arus  https://t.co/FFhDkzA2Bz	in	[]	['https://www.onlineindo.tv/2022/11/minta-kuat-maruf-dan-ricky-rizal-tak.html']	[]	0	0	0	[]	[]	https://twitter.com/RepelitaO/status/1587799821402124288	False		0								[]				
1587799484276383746	1587799484276383746	2022-11-02 20:31:11 SE Asia Standard Time	2022-11-02	20:31:11	+0700	759692754985242625	kumparan	kumparan		Ibu Brigadir Nofriansyah Yosua Hutabarat, Rosti Simanjuntak, menyinggung hubungan Kuat Ma'ruf dengan Putri Candrawathi, saat memberikan kesaksian di persidangan Kuat dan Ricky Rizal, Rabu (02/11). #dailyupdate #2nov #videonews #TopNews  https://t.co/yuL3qWapf1  https://t.co/AURWDuPspW	in	[]	['http://bit.ly/3SYkOGJ']	[]	1	4	6	['dailyupdate', '2nov', 'videonews', 'topnews']	[]	https://twitter.com/kumparan/status/1587799484276383746	False		1	https://pbs.twimg.com/ext_tw_video_thumb/1587799291485212675/pu/img/LAwgOj5-ES4RkKsY.jpg							[]				
1587794457205710849	1587794457205710849	2022-11-02 20:11:13 SE Asia Standard Time	2022-11-02	20:11:13	+0700	243177995	tintahijaucom	TINTAHIJAU.com		Dengan Nada Tinggi, Ibu Brigadir J Minta Kuat Ma’ruf dan Ricky Rizal Bicara Jujur  https://t.co/3DaylqgXcS’ruf-dan-ricky-rizal-bicara-jujur	in	[]	['https://www.tintahijau.com/megapolitan/hukum/40075-dengan-nada-tinggi,-ibu-brigadir-j-minta-kuat-ma']	[]	0	0	0	[]	[]	https://twitter.com/TINTAHIJAUcom/status/1587794457205710849	False		0								[]				
1587790436286214146	1587790436286214146	2022-11-02 19:55:14 SE Asia Standard Time	2022-11-02	19:55:14	+0700	375995332	officialinewstv	iNews		Pantauan perjalanan persidangan dari pemeriksaan saksi dengan terdakwa Kuat Ma'ruf dan Ricky Rizal pada hari ini. TWS  #iNews #BreakingNews #KuatMa'ruf #Kesaksian #IbuBrigadirJ #BrgadirJ #Polisi #FerdySambo #PutriCandrawathi #Kesedihan #Pembunuhan  https://t.co/o4s0LOknuX	in	[]	[]	[]	0	1	0	['inews', 'breakingnews', 'kuatma', 'kesaksian', 'ibubrigadirj', 'brgadirj', 'polisi', 'ferdysambo', 'putricandrawathi', 'kesedihan', 'pembunuhan']	[]	https://twitter.com/OfficialiNewsTV/status/1587790436286214146	False		1	https://pbs.twimg.com/amplify_video_thumb/1587771730130788352/img/UPeEy7DJndOqELbe.jpg							[]				
1587788614200872960	1587788614200872960	2022-11-02 19:47:59 SE Asia Standard Time	2022-11-02	19:47:59	+0700	2669110243	valentinass95	Valentina Sitorus		"""Hewan saja mati pasti mendapatkan pertolongan, ini kalian manusia diciptakan Tuhan normal punya mata, punya hati. Tp satupun kalian di rumah FS, mengikuti skenario atasanmu itu?"" Rosti Simanjuntak kepada Kuat Ma'ruf &amp; Ricky Rizal saat sidang pembuktian (2/11)  🥹🥹🥹"	in	[]	[]	[]	0	0	0	[]	[]	https://twitter.com/valentinass95/status/1587788614200872960	False		0								[]				
1587777888740220929	1587777888740220929	2022-11-02 19:05:22 SE Asia Standard Time	2022-11-02	19:05:22	+0700	1393950183596068869	wandystjk	🇮🇩🅦🅐🅝🅓🅨 Ⓢⓘⓣⓘⓝⓙⓐⓚ🇮🇩		Kuat Ma'ruf dan Ricky Rizal dihadapkan dengan keluarga almarhum Yosua. Sedih lihat seorang ibu menangis😥😥  https://t.co/wmMvIOpCxT	in	[]	[]	[]	9	29	132	[]	[]	https://twitter.com/Wandystjk/status/1587777888740220929	False		1	https://pbs.twimg.com/ext_tw_video_thumb/1587777422262292480/pu/img/tFZ5Z6WBAu6tttKX.jpg							[]				
1587765713670139910	1587765713670139910	2022-11-02 18:17:00 SE Asia Standard Time	2022-11-02	18:17:00	+0700	835032314505658368	rikkisihaloho	RIKI SIHALOHO		Rosti Simanjuntak heran Kuat Ma'ruf baru meminta maaf setelah 5 bulan anaknya tewas. Rosti mengungkit skenario Ferdy Sambo yang turut diikuti Kuat dan Ricky.	in	[]	[]	[]	0	0	0	[]	[]	https://twitter.com/rikkisihaloho/status/1587765713670139910	False		0								[]				
1587765245157990401	1587765245157990401	2022-11-02 18:15:08 SE Asia Standard Time	2022-11-02	18:15:08	+0700	868421017	j3rry76	#GusDur		Sidang lanjutan pembunuhan Yosua alias Brigadir J mengahdirkan Kuat Ma'ruf dan Ricky Rizal. Ibu Rosti Simanjuntak mengatakan : Jangan seperti Ferdy Sambo dan PC, maaf nya hanya dibibir! Dan kamu Kuat Ma'ruf, kamu siapanya PC?!  Kuat Ma'ruf sedang akting  https://t.co/9CB3qTbbaJ	in	[]	[]	[]	0	2	19	[]	[]	https://twitter.com/J3RRY76/status/1587765245157990401	False		1	https://pbs.twimg.com/ext_tw_video_thumb/1587764986738544640/pu/img/mOgQUqxgTwLrMagn.jpg							[]				
1587764549532672000	1587764549532672000	2022-11-02 18:12:22 SE Asia Standard Time	2022-11-02	18:12:22	+0700	57261519	metro_tv	METRO TV		Ibu #BrigadirYosua menanyakan kepada Kuat Ma'ruf dan Ricky Rizal kenapa baru sekarang ada kesadaran untuk minta maaf. Rosti mengatakan perbuatan segerombolan orang di rumah Ferdy Sambo terhadap anaknya sangat keji dan sadis.  #ferdysambo #sidangferdysambo #kasusferdysambo  https://t.co/YwxvRYLCbH	in	[]	[]	[]	4	6	26	['brigadiryosua', 'ferdysambo', 'sidangferdysambo', 'kasusferdysambo']	[]	https://twitter.com/Metro_TV/status/1587764549532672000	False		1	https://pbs.twimg.com/amplify_video_thumb/1587760690110287873/img/LCgnB495zgc2FNax.jpg							[]				
1587762258104709120	1587762258104709120	2022-11-02 18:03:16 SE Asia Standard Time	2022-11-02	18:03:16	+0700	57261519	metro_tv	METRO TV		Dalam sidang lanjutan kasus pembunuhan berencana Brigadir J, Kuat Ma'ruf dan Ricky Rizal menyampaika permintaan maafnya kepada keluarga Brigadir J. Rosti menyiratkan permintaan maaf Kuat dan Ricky sia-sia.  #ferdysambo #brigadirJ #sidangferdysambo #RickyRizal #KuatMaruf  https://t.co/xniVlFTw7E	in	[]	[]	['https://pbs.twimg.com/media/FgjdSWwaEAAi_EL.jpg']	1	1	8	['ferdysambo', 'brigadirj', 'sidangferdysambo', 'rickyrizal', 'kuatmaruf']	[]	https://twitter.com/Metro_TV/status/1587762258104709120	False		1	https://pbs.twimg.com/media/FgjdSWwaEAAi_EL.jpg							[]				
1587759631085936642	1587759631085936642	2022-11-02 17:52:49 SE Asia Standard Time	2022-11-02	17:52:49	+0700	180696019	sonorafm92	Radio Sonora Jakarta		17.51 #BeritaSONORA - Ayah Brigadir J Peringatkan Ricky Rizal dan Kuat Ma'ruf: kalau Terbawa Arus, Anda Dimakan Arus!  https://t.co/lZWjrAEveG via @KompasTV	in	[{'screen_name': 'kompastv', 'name': 'kompas tv', 'id': '71436318'}]	['http://dlvr.it/Sc5Tdj']	[]	0	0	0	['beritasonora']	[]	https://twitter.com/SonoraFM92/status/1587759631085936642	False		0								[]				
1587758438939230208	1587758438939230208	2022-11-02 17:48:05 SE Asia Standard Time	2022-11-02	17:48:05	+0700	57261519	metro_tv	METRO TV		"Ayah #BrigadirYosua berpesan kepada Kuat Ma'ruf dan Ricky Rizal agar tidak mengikuti arus kebohongan skenario terkait kematian anaknya. ""Janganlah kalian berdua terbawa arus. Kalau Anda berdua terbawa arus, Anda dimakan arus, paham?"", kata Samuel. #ferdysambo #sidangferdysambo  https://t.co/hmkS4ZCysf"	in	[]	[]	['https://pbs.twimg.com/media/FgjZco-akAATO8c.jpg']	4	2	14	['brigadiryosua', 'ferdysambo', 'sidangferdysambo']	[]	https://twitter.com/Metro_TV/status/1587758438939230208	False		1	https://pbs.twimg.com/media/FgjZco-akAATO8c.jpg							[]				
1587743993869254656	1587743993869254656	2022-11-02 16:50:41 SE Asia Standard Time	2022-11-02	16:50:41	+0700	1062697782425772032	wjtodaycom	West Java Today		Ayah Almarhum Brigadir J Minta Terdakwa Kuat Ma'ruf dan Ricky Rizal Tak Terbawa Arus  https://t.co/U5HHiPsuPm	in	[]	['https://ift.tt/LoyFDTM']	[]	0	0	0	[]	[]	https://twitter.com/wjtodaycom/status/1587743993869254656	False		0								[]				
1587743989339492353	1587743989339492353	2022-11-02 16:50:40 SE Asia Standard Time	2022-11-02	16:50:40	+0700	1062697782425772032	wjtodaycom	West Java Today		Luapan Perasaan Ibunda Almarhum Brigadir J kepada Terdakwa Kuat Ma’ruf dan Ricky Rizal  https://t.co/j7hYDuLTY8	in	[]	['https://ift.tt/lf2CmvL']	[]	0	0	0	[]	[]	https://twitter.com/wjtodaycom/status/1587743989339492353	False		0								[]				
