id	conversation_id	created_at	date	time	timezone	user_id	username	name	place	tweet	language	mentions	urls	photos	replies_count	retweets_count	likes_count	hashtags	cashtags	link	retweet	quote_url	video	thumbnail	near	geo	source	user_rt_id	user_rt	retweet_id	reply_to	retweet_date	translate	trans_src	trans_dest
1600469796646449152	1600469796646449152	2022-12-07 19:38:29 SE Asia Standard Time	2022-12-07	19:38:29	+0700	598959076	20detik	20DETIK		Ruang Tahanan Ricky Rizal dan Kuat Ma'ruf Bakal Dipisah!  https://t.co/BZ4gYF8RqC	in	[]	['https://20.detik.com/detikflash/20221207-221207116/ruang-tahanan-ricky-rizal-dan-kuat-maruf-bakal-dipisah??utm_campaign=detikcomsocmed&utm_medium=oa&utm_source=twitter&utm_content=20detik']	[]	0	0	0	[]	[]	https://twitter.com/20detik/status/1600469796646449152	False		0								[]				
1600452243358363650	1600452243358363650	2022-12-07 18:28:44 SE Asia Standard Time	2022-12-07	18:28:44	+0700	18071520	antaranews	antaranews.com		Ferdy Sambo bantah pernyataan dirinya janjikan uang kepada terdakwa Richard Eliezer, terdakwa Ricky Rizal, dan terdakwa Kuat Ma’ruf.  “Saya tidak menjanjikan uang, Yang Mulia,” kata Sambo.  #FerdySambo #brigadirJ   https://t.co/O51LA8ltEx	in	[]	['https://www.antaranews.com/berita/3291511/ferdy-sambo-bantah-janjikan-uang-ke-eliezer-ricky-dan-kuat']	[]	0	0	0	['ferdysambo', 'brigadirj']	[]	https://twitter.com/antaranews/status/1600452243358363650	False		0								[]				
1600451070366715904	1600451070366715904	2022-12-07 18:24:04 SE Asia Standard Time	2022-12-07	18:24:04	+0700	1540286824144596993	parhobas6	parhobas		Seharusnya dari dulu tahanannya terpisah agar tidak bisa menyusun siasat.#  https://t.co/ONueijZnQo  Ricky Rizal dan Kuat Ma'ruf akan ditahan di rutan terpisah agar tidak terjalin komunikasi satu sama lain.	in	[]	['https://news.detik.com/berita/d-6448533/ricky-rizal-dan-kuat-maruf-kini-ditahan-di-sel-terpisah']	[]	0	0	0	[]	[]	https://twitter.com/parhobas6/status/1600451070366715904	False		0								[]				
1600446006281342977	1600446006281342977	2022-12-07 18:03:57 SE Asia Standard Time	2022-12-07	18:03:57	+0700	69183155	detikcom	detikcom		Ricky Rizal dan Kuat Ma'ruf akan ditahan di rutan terpisah agar tidak terjalin komunikasi satu sama lain.  https://t.co/aeKnYZbfyD	in	[]	['https://news.detik.com/berita/d-6448533/ricky-rizal-dan-kuat-maruf-kini-ditahan-di-sel-terpisah?utm_term=echoboxauto&utm_campaign=detikcomsocmed&utm_medium=oa&utm_content=detikcom&utm_source=Twitter#Echobox=1670410996']	[]	15	7	27	[]	[]	https://twitter.com/detikcom/status/1600446006281342977	False		0								[]				
1600443119128006656	1600443119128006656	2022-12-07 17:52:29 SE Asia Standard Time	2022-12-07	17:52:29	+0700	69183155	detikcom	detikcom		Ferdy Sambo bersaksi dalam sidang lanjutan Bharada Richard Eliezer, Bripka Ricky Rizal, dan Kuat Ma'ruf. Begini momennya.  https://t.co/JJPX6IwNqR	in	[]	['https://news.detik.com/foto-news/d-6448470/momen-ferdy-sambo-bersaksi-untuk-richard-eliezer-bripka-ricky-dan-kuat-maruf?utm_term=echoboxauto&utm_campaign=detikcomsocmed&utm_medium=oa&utm_content=detikcom&utm_source=Twitter#Echobox=1670410290']	[]	0	0	1	[]	[]	https://twitter.com/detikcom/status/1600443119128006656	False		0								[]				
1600432931993886720	1600432931993886720	2022-12-07 17:12:00 SE Asia Standard Time	2022-12-07	17:12:00	+0700	891906384794599424	radarsolo_	Jawa Pos Radar Solo		Hakim Ketua Wahyu Iman Santoso menilai keterangan Ferdy Sambo sebagai saksi untuk terdakwa Bharada Richard Eliezer Pudihang Lumiu, Bripka Ricky Rizal, dan Kuat Ma’ruf, tidak masuk akal. #ferdysambo #SidangFerdySambo   https://t.co/iZ5IocdHuB	in	[]	['https://radarsolo.jawapos.com/nasional/07/12/2022/hakim-sebut-kesaksian-ferdy-sambo-banyak-kejanggalan-cerita-saudara-tak-masuk-akal/']	[]	0	0	0	['ferdysambo', 'sidangferdysambo']	[]	https://twitter.com/RADARSOLO_/status/1600432931993886720	False		0								[]				
1600430702205759488	1600430702205759488	2022-12-07 17:03:08 SE Asia Standard Time	2022-12-07	17:03:08	+0700	58880688	pikiran_rakyat	Pikiran Rakyat		Kesaksian Benny Ali: Kuat Ma'ruf dan Ricky Rizal Tiarap saat Penembakan Brigadir J  https://t.co/wjJ33G1jqz  https://t.co/NunT9dPP6P	in	[]	['http://dlvr.it/SdzDjW']	['https://pbs.twimg.com/media/FjXfPeFacAACa8a.png']	0	0	0	[]	[]	https://twitter.com/pikiran_rakyat/status/1600430702205759488	False		1	https://pbs.twimg.com/media/FjXfPeFacAACa8a.png							[]				
1600429085204746240	1600429085204746240	2022-12-07 16:56:43 SE Asia Standard Time	2022-12-07	16:56:43	+0700	1568106713890570240	eksplisito	Eksplisit Official		Momen Sidang Ferdy Sambo Hari Ini di  PN Jakarta Selatan, Saat Berhadapan Langsung dengan Richard Eliezer, Ricky Rizal dan Kuat Ma'ruf.  https://t.co/tEo3niKZyG #ferdysambo #richardeliezer #SidangFerdySambo #sidangsambo #bombunuhdiri #EksplisitKreatifMedia #EksplisitOfficial	in	[]	['https://vt.tiktok.com/ZS8L89cWE/']	[]	0	0	2	['ferdysambo', 'richardeliezer', 'sidangferdysambo', 'sidangsambo', 'bombunuhdiri', 'eksplisitkreatifmedia', 'eksplisitofficial']	[]	https://twitter.com/EksplisitO/status/1600429085204746240	False		0								[]				
1600427395537899520	1600427395537899520	2022-12-07 16:50:00 SE Asia Standard Time	2022-12-07	16:50:00	+0700	944180887171743745	inewsdotid	iNews.id		Bukan Uang, Sambo Janji Rawat Keluarga Bharada E, Ricky Rizal dan Kuat Ma'ruf jika Ikut Skenarionya  https://t.co/UDCIYIZI0B.	in	[]	['https://www.inews.id/news/nasional/bukan-uang-sambo-janji-rawat-keluarga-bharada-e-ricky-rizal-dan-kuat-maruf-jika-ikut-skenarionya']	[]	0	0	0	[]	[]	https://twitter.com/inewsdotid/status/1600427395537899520	False		0								[]				
1600423157789335552	1600423157789335552	2022-12-07 16:33:09 SE Asia Standard Time	2022-12-07	16:33:09	+0700	255866913	hariankompas	Harian Kompas		PN Jakarta Selatan kembali menggelar sidang lanjutan terdakwa Bharada E, Ricky Rizal, dan Kuat Ma'ruf atas kasus pembunuhan berencana terhadap Brigadir J. JPU menghadirkan terdakwa Ferdy Sambo sebagai saksi. #Polhuk #AdadiKompas   https://t.co/cZkdgujBUb	in	[]	['https://www.kompas.id/baca/foto/2022/12/07/ferdy-sambo-jadi-saksi-sidang-bharada-e?utm_source=medsos_twitter&utm_medium=link&utm_campaign=medsos_auto_polhuk']	[]	0	0	0	['polhuk', 'adadikompas']	[]	https://twitter.com/hariankompas/status/1600423157789335552	False		0								[]				
1600423155469758464	1600423155469758464	2022-12-07 16:33:09 SE Asia Standard Time	2022-12-07	16:33:09	+0700	771030588	kompasdata	Kompas Data		PN Jakarta Selatan kembali menggelar sidang lanjutan terdakwa Bharada E, Ricky Rizal, dan Kuat Ma'ruf atas kasus pembunuhan berencana terhadap Brigadir J. JPU menghadirkan terdakwa Ferdy Sambo sebagai saksi. #Polhuk #AdadiKompas  https://t.co/ezGLWiNFx2	in	[]	['https://www.kompas.id/baca/foto/2022/12/07/ferdy-sambo-jadi-saksi-sidang-bharada-e?utm_source=medsos_twitter_kompasdata&utm_medium=link&utm_campaign=medsos_auto_polhuk']	[]	0	0	0	['polhuk', 'adadikompas']	[]	https://twitter.com/KompasData/status/1600423155469758464	False		0								[]				
1600422364570824704	1600422364570824704	2022-12-07 16:30:00 SE Asia Standard Time	2022-12-07	16:30:00	+0700	71436318	kompastv	KOMPAS TV		Mantan Kadiv Propam Polri, Ferdy Sambo dihadirkan sebagai saksi bagi terdakwa Eliezer, Kuat Ma'ruf, dan Ricky Rizal. Sambo menjelaskan bahwa Eliezer resmi menjadi sopir sejak dirinya menjabat sebagai Kadiv Propam Polri di bulan November 2021.    https://t.co/PjHsUCP11M  https://t.co/KVzGqknstP	in	[]	['https://www.kompas.tv/article/356011/saat-menjabat-sebagai-kadiv-propam-polri-sambo-difasilitasi-3-driver-yang-termasuk-eliezer']	[]	0	1	4	[]	[]	https://twitter.com/KompasTV/status/1600422364570824704	False		1	https://pbs.twimg.com/amplify_video_thumb/1600405245393530885/img/-cfte8RbTCVTKRvA.jpg							[]				
1600414846750953472	1600414846750953472	2022-12-07 16:00:08 SE Asia Standard Time	2022-12-07	16:00:08	+0700	18129942	tempodotco	tempo.co		Saat Kuat Ma'ruf dan Ricky Rizal Bantah Kesaksian Benny Ali  https://t.co/uWpqpo0LUr #TempoFoto	in	[]	['https://foto.tempo.co/read/102296/saat-kuat-maruf-dan-ricky-rizal-bantah-kesaksian-benny-ali?utm_source=Twitter&utm_medium=dlvr.it']	[]	0	0	0	['tempofoto']	[]	https://twitter.com/tempodotco/status/1600414846750953472	False		0								[]				
1600405807627403265	1600405807627403265	2022-12-07 15:24:13 SE Asia Standard Time	2022-12-07	15:24:13	+0700	46693036	inilahdotcom	inilahcom		Terdakwa perkara pembunuhan Yosua Hutabarat (Brigadir J) yakni Ricky Rizal dan Kuat Ma’ruf kompak menipu Benny Ali, ketika pertama kali diperiksa di TKP, rumah dinas Kadiv Propam Polri, 8 Juli 2022 yang lalu. Benny selaku Karoprovos Divpropam Polri…  https://t.co/az0KcC2pc9	in	[]	['https://www.inilah.com/anak-buah-ferdy-sambo-tipu-benny-ali-bantah-saksikan-penembakan-brigadir-j?utm_source=dlvr.it&utm_medium=twitter']	[]	0	0	0	[]	[]	https://twitter.com/inilahdotcom/status/1600405807627403265	False		0								[]				
1600400242171465729	1600400242171465729	2022-12-07 15:02:06 SE Asia Standard Time	2022-12-07	15:02:06	+0700	57261519	metro_tv	METRO TV		BREAKING NEWS - SAMBO HADAPI ELIEZER, RICKY RIZAL DAN KUAT MA'RUF  https://t.co/jxjfidedxs	in	[]	['https://twitter.com/i/broadcasts/1ypKddjBngQKW']	[]	0	0	4	[]	[]	https://twitter.com/Metro_TV/status/1600400242171465729	False		0								[]				
1600395397347700736	1600395397347700736	2022-12-07 14:42:51 SE Asia Standard Time	2022-12-07	14:42:51	+0700	1320891038014214145	newsjerami	Jerami News		Ricky Rizal dan Kuat Ma’ruf Sangkal Kesaksian Benny Ali  https://t.co/FQRunewV5b	in	[]	['https://www.jerami.id/2022/12/07/ricky-rizal-dan-kuat-maruf-sangkal-kesaksian-benny-ali/']	[]	0	2	1	[]	[]	https://twitter.com/NewsJerami/status/1600395397347700736	False		0								[]				
1600382948649635840	1600382948649635840	2022-12-07 13:53:23 SE Asia Standard Time	2022-12-07	13:53:23	+0700	2393930923	lensartv	Lensa Indonesia RTV		Putri Candrawathi menolak hadir sebagai saksi untuk terdakwa Bharada E, Ricky Rizal, &amp; Kuat Ma'ruf, Rabu (7/12). Kuasa hukum Putri, Febri Diansyah mengatakan,  telah meminta pengajuan permohonan pemeriksaan saksi terhadap Putri Candrawathi dilakukan tertutup.  #sidanglanjutan  https://t.co/pLVUnVTJ5L	in	[]	[]	[]	0	0	0	['sidanglanjutan']	[]	https://twitter.com/lensaRTV/status/1600382948649635840	False		1	https://pbs.twimg.com/ext_tw_video_thumb/1600382817653133312/pu/img/KZunz73siVSvRvL1.jpg							[]				
1600374460346818560	1600374460346818560	2022-12-07 13:19:39 SE Asia Standard Time	2022-12-07	13:19:39	+0700	902837643024539651	medcom_id	medcom_id		Putri Candrawathi menolak hadir sebagai saksi untuk terdakwa Richard Eliezer Pudihang Lumiu alias Bharada E, Ricky Rizal, dan Kuat Ma'ruf pada Rabu, 7 Desember 2022. Pasalnya, Kubu Putri Candrawathi minta persidangan tertutup  #MedcomID    https://t.co/GjvCtA6Ir6	in	[]	['https://www.medcom.id/nasional/hukum/RkjeL8Qb-saat-kubu-putri-candrawathi-ngotot-minta-sidang-tertutup']	[]	0	0	0	['medcomid']	[]	https://twitter.com/medcom_id/status/1600374460346818560	False		0								[]				
1600367786618130433	1600367786618130433	2022-12-07 12:53:08 SE Asia Standard Time	2022-12-07	12:53:08	+0700	759692754985242625	kumparan	kumparan		Ajudan dan sopir Ferdy Sambo, Ricky Rizal dan Kuat Ma'ruf membantah keterangan dari eks Karo Provos Divisi Propam Polri, Brigjen Benny Ali. Ini kesaksian mereka. #kumparanNEWS #newsupdate  https://t.co/cy5Y1Ks041	in	[]	['https://kumparan.com/kumparannews/ricky-and-kuat-kompak-bantah-pernah-diperiksa-benny-ali-bapak-tidak-periksa-saya-1zOOo6gyYzM?utm_source=Twitter&utm_medium=post&utm_campaign=int']	[]	0	0	1	['kumparannews', 'newsupdate']	[]	https://twitter.com/kumparan/status/1600367786618130433	False		0								[]				
1600365787868692482	1600365787868692482	2022-12-07 12:45:11 SE Asia Standard Time	2022-12-07	12:45:11	+0700	154102750	beritasatu	BeritaSatu		Wajah Richard, Ricky Rizal, dan Kuat Ma'ruf Tampak Stres Saat Dicecar Benny Ali  https://t.co/rn53vSLAwT	in	[]	['https://www.beritasatu.com/news/1006521/wajah-richard-ricky-rizal-dan-kuat-maruf-tampak-stres-saat-dicecar-benny-ali']	[]	0	1	1	[]	[]	https://twitter.com/Beritasatu/status/1600365787868692482	False		0								[]				
1600363099730501633	1600363099730501633	2022-12-07 12:34:30 SE Asia Standard Time	2022-12-07	12:34:30	+0700	902837643024539651	medcom_id	medcom_id		Ferdy Sambo menjadi saksi dalam sidang lanjutan kasus pembunuhan berencana terhadap Brigadir J hari ini. Dia menjadi saksi mahkota untuk terdakwa Richard Eliezer Pudihang Lumiu alias Bharada E, Ricky Rizal, dan Kuat Ma'ruf  #MedcomID   https://t.co/3UWqK5jo52	in	[]	['https://www.medcom.id/nasional/hukum/ybJQpD4N-hari-ini-ferdy-sambo-jadi-saksi-mahkota-untuk-bharada-e-cs']	[]	0	0	0	['medcomid']	[]	https://twitter.com/medcom_id/status/1600363099730501633	False		0								[]				
1600351662308483072	1600351662308483072	2022-12-07 11:49:04 SE Asia Standard Time	2022-12-07	11:49:04	+0700	759692754985242625	kumparan	kumparan		Mantan Karo Provos Divisi Propam Polri, Brigjen Benny Ali, melihat wajah sopir Ferdy Sambo dan ajudannya, Kuat Ma'ruf serta Ricky Rizal, seperti tengah stres. #kumparanNEWS #newsupdate  https://t.co/0Y6RTvtHCH	in	[]	['https://kumparan.com/kumparannews/benny-ali-ungkap-kondisi-tkp-duren-tiga-wajah-eliezer-kuat-ricky-nampak-stres-1zONy4HPWLy?utm_source=Twitter&utm_medium=post&utm_campaign=int']	[]	0	1	2	['kumparannews', 'newsupdate']	[]	https://twitter.com/kumparan/status/1600351662308483072	False		0								[]				
1600351467680206849	1600351467680206849	2022-12-07 11:48:17 SE Asia Standard Time	2022-12-07	11:48:17	+0700	56941253	lintangmaraya	Lintang maraya		Kok gue yg deg2an ya Sambo jadi saksi buat Eliezer, Ricky Rizal &amp; Kuat Ma'ruf 🤭	in	[]	[]	[]	0	0	0	[]	[]	https://twitter.com/lintangmaraya/status/1600351467680206849	False		0								[]				
1600340295115235330	1600340295115235330	2022-12-07 11:03:53 SE Asia Standard Time	2022-12-07	11:03:53	+0700	69183155	detikcom	detikcom		Sidang lanjutan pembunuhan berencana Brigadir N Yosua Hutabarat dengan terdakwa Bharada Richard Eliezer, Bripka Ricky Rizal dan Kuat Ma'ruf kembali digelar.  https://t.co/sSDDI9O4tZ	in	[]	[]	[]	0	0	5	[]	[]	https://twitter.com/detikcom/status/1600340295115235330	False		1	https://pbs.twimg.com/ext_tw_video_thumb/1600340208515424256/pu/img/X_Kydna5L5F-JfIn.jpg							[]				
1600336885716393985	1600336885716393985	2022-12-07 10:50:21 SE Asia Standard Time	2022-12-07	10:50:21	+0700	456426648	merdekadotcom	Merdeka.com		[FULL] Ferdy Sambo Ultimatum Bharada E: Jangan Libatkan Istri Saya, Ricky dan Kuat Ma'ruf!  https://t.co/eHo0iwUUXt	in	[]	[]	[]	0	1	2	[]	[]	https://twitter.com/merdekadotcom/status/1600336885716393985	False		1	https://pbs.twimg.com/amplify_video_thumb/1600335524023046145/img/X3o41Rp00CnwK_ux.jpg							[]				
1600325498328223745	1600325498328223745	2022-12-07 10:05:06 SE Asia Standard Time	2022-12-07	10:05:06	+0700	71436318	kompastv	KOMPAS TV		BREAKING NEWS - Sidang Pemeriksaan Saksi Ferdy Sambo Atas Terdakwa Eliezer, Ricky, dan Kuat Ma'Ruf   https://t.co/NU8Vm7DiDl  https://t.co/s4Yz14UNvu	in	[]	['https://youtu.be/hpmn_v-zi7s']	['https://pbs.twimg.com/media/FjV_jjaaUAAGhIs.jpg']	1	1	3	[]	[]	https://twitter.com/KompasTV/status/1600325498328223745	False		1	https://pbs.twimg.com/media/FjV_jjaaUAAGhIs.jpg							[]				
1600324727054422018	1600324727054422018	2022-12-07 10:02:02 SE Asia Standard Time	2022-12-07	10:02:02	+0700	759692754985242625	kumparan	kumparan		[LIVE NOW]  Ferdy Sambo Rabu (7/12) dihadirkan di sidang lanjutan Bharada Richard Eliezer, Bripka Ricky Rizal, dan Kuat Ma'ruf. Sambo dihadirkan untuk menjadi saksi untuk tiga terdakwa. Simak hanya di YouTube kumparan. #newsupdate #sidangsambo #news #ls  https://t.co/PrjO7y92KS	in	[]	['http://bit.ly/3Y729wi']	[]	0	0	1	['newsupdate', 'sidangsambo', 'news', 'ls']	[]	https://twitter.com/kumparan/status/1600324727054422018	False		0								[]				
1600310940158812160	1600310940158812160	2022-12-07 09:07:15 SE Asia Standard Time	2022-12-07	09:07:15	+0700	69183155	detikcom	detikcom		Ferdy Sambo hari ini dihadirkan di sidang lanjutan Bharada E, Bripka Ricky Rizal, dan Kuat Ma'ruf. Ferdy Sambo dihadirkan menjadi saksi untuk tiga terdakwa!  https://t.co/fpzpKc6VAY	in	[]	['https://news.detik.com/berita/d-6447081/ferdy-sambo-bersaksi-hari-ini-akan-berhadapan-dengan-eliezer-dkk?utm_content=detikcom&utm_term=echobox&utm_medium=oa&utm_campaign=detikcomsocmed&utm_source=Twitter#Echobox=1670377855-1']	[]	1	0	3	[]	[]	https://twitter.com/detikcom/status/1600310940158812160	False		0								[]				
1600304825681387521	1600304825681387521	2022-12-07 08:42:57 SE Asia Standard Time	2022-12-07	08:42:57	+0700	4187275698	tirtoid	tirtoid		Ferdy Sambo akan menjadi saksi untuk terdakwa Richard Eliezer, Kuat Ma'ruf dan Ricky Rizal.   https://t.co/VeCHeTMOWm	in	[]	['https://tirto.id/gzvi']	[]	2	1	10	[]	[]	https://twitter.com/TirtoID/status/1600304825681387521	False		0								[]				
1600290509532336128	1600290509532336128	2022-12-07 07:46:04 SE Asia Standard Time	2022-12-07	07:46:04	+0700	759692754985242625	kumparan	kumparan		Ferdy Sambo mendapatkan giliran bersaksi untuk tiga terdakwa yakni Richard Eliezer, Kuat Ma'ruf, dan Ricky Rizal. #kumparanNEWS #newsupdate  https://t.co/HAtZcpbEES	in	[]	['https://kumparan.com/kumparannews/ferdy-sambo-akan-bersaksi-di-sidang-richard-eliezer-dkk-hari-ini-1zOKIsPj4Po?utm_source=Twitter&utm_medium=post&utm_campaign=int']	[]	0	0	0	['kumparannews', 'newsupdate']	[]	https://twitter.com/kumparan/status/1600290509532336128	False		0								[]				
1600286859363774464	1600286859363774464	2022-12-07 07:31:33 SE Asia Standard Time	2022-12-07	07:31:33	+0700	23343960	kompascom	Kompas.com		Jaksa akamenghadirkan terdakwa Ferdy Sambo sebagai saksi untuk terdakwa Bharada E, Bripka Ricky Rizal, dan Kuat Ma'ruf.  https://t.co/PfWA6rZeO5	in	[]	['http://dlvr.it/SdyDlL']	[]	0	0	0	[]	[]	https://twitter.com/kompascom/status/1600286859363774464	False		0								[]				
1600230947584032770	1600230947584032770	2022-12-07 03:49:23 SE Asia Standard Time	2022-12-07	03:49:23	+0700	2847746144	baranewsaceh	baraNews		Saksi Ricky Ceritakan Momen Kuat Ma’ruf Bawa Pisau Kejar Brigadir J  https://t.co/NFc5JlII6I	in	[]	['https://www.timeindonesia.co/2022/12/07/saksi-ricky-ceritakan-momen-kuat-maruf-bawa-pisau-kejar-brigadir-j/']	[]	0	0	0	[]	[]	https://twitter.com/Baranewsaceh/status/1600230947584032770	False		0								[]				
1600110771341774848	1600110771341774848	2022-12-06 19:51:51 SE Asia Standard Time	2022-12-06	19:51:51	+0700	18129942	tempodotco	tempo.co		"""Apa maksudnya jangan libatin Ricky Rizal, Kuat Ma'ruf, dan Putri Candrawathi? Terus mau korbanin Richard Eliezer?"" Kata Ronny Talapessy tanggapi perkataan Ferdy Sambo. #TempoNasional  https://t.co/WjqcTB6jTK"	in	[]	['https://nasional.tempo.co/read/1665207/kuasa-hukum-richard-eliezer-menduga-ferdy-sambo-mau-korbankan-kliennya?utm_source=Twitter&utm_medium=Audev&utm_campaign=Nasional_Syahdi']	[]	2	1	3	['temponasional']	[]	https://twitter.com/tempodotco/status/1600110771341774848	False		0								[]				
1600098413864886272	1600098413864886272	2022-12-06 19:02:44 SE Asia Standard Time	2022-12-06	19:02:44	+0700	1186946650595418116	voidotid	Voidotid		Majelis hakim pada Pengadilan Negeri Jakarta Selatan memutuskan Ferdy Sambo yang akan menjadi saksi untuk terdakwa Bharada Eliezer, Bripka Ricky Rizal, dan Kuat Ma'ruf di...  https://t.co/afWqw18wxw	in	[]	['https://voi.id/berita/233711/besok-ferdy-sambo-bakal-jadi-saksi-untuk-bharada-e-bripka-rr-dan-kuat-ma-ruf']	[]	0	0	2	[]	[]	https://twitter.com/voidotid/status/1600098413864886272	False		0								[]				
1600073828172013568	1600073828172013568	2022-12-06 17:25:03 SE Asia Standard Time	2022-12-06	17:25:03	+0700	527632417	media_linked	Medialink		"TRANS7: Hakim persidangan ""sentil"" Ricky Rizal &amp; Kuat Ma'ruf. #Redaksi  https://t.co/X7pr5MehQj"	in	[]	[]	[]	0	0	0	['redaksi']	[]	https://twitter.com/Media_linked/status/1600073828172013568	False		1	https://pbs.twimg.com/media/FjSOSD4XgAAmauf.jpg							[]				
1600073070525681665	1600073070525681665	2022-12-06 17:22:02 SE Asia Standard Time	2022-12-06	17:22:02	+0700	1520998271161831424	tauberitamedia	tauberita		Eks Karo Provos Propam Polri Benny Ali ungkap Ricky Rizal dan Kuat Ma'ruf cerita soal skenario tembak-menembak saat ditanya tak lama Brigadir J tewas   https://t.co/aavESj7E9F	in	[]	['https://www.tauberita.com/benny-ali-ungkap-kuat-maruf-dan-ricky-rizal-lancar-cerita-situasi-tembak-menembak-tak-lama-usai-brigadir-j-tewas']	[]	0	0	0	[]	[]	https://twitter.com/tauberitamedia/status/1600073070525681665	False		0								[]				
1600072819420766210	1600072819420766210	2022-12-06 17:21:02 SE Asia Standard Time	2022-12-06	17:21:02	+0700	1520998271161831424	tauberitamedia	tauberita		Eks Karo Provos Propam Polri Benny Ali ungkap Ricky Rizal dan Kuat Ma'ruf cerita soal skenario tembak-menembak saat ditanya tak lama Brigadir J tewas   https://t.co/aavESiPuVx	in	[]	['https://www.tauberita.com/benny-ali-ungkap-kuat-maruf-dan-ricky-rizal-lancar-cerita-situasi-tembak-menembak-tak-lama-usai-brigadir-j-tewas']	[]	0	0	0	[]	[]	https://twitter.com/tauberitamedia/status/1600072819420766210	False		0								[]				
1600071178466361344	1600071178466361344	2022-12-06 17:14:31 SE Asia Standard Time	2022-12-06	17:14:31	+0700	64635651	serambinews	Serambi Indonesia		#KuatMaruf #FerdySambo #brigadirJ #Sidang   Setelah Bharada Eliezer tertawakan kesaksian Ricky Rizal, giliran hakim tertawa mendengar kesaksian Kuat Ma'ruf.   https://t.co/IAXWBLLnsw	in	[]	['https://aceh.tribunnews.com/2022/12/06/giliran-hakim-tertawa-dengar-kesaksian-kuat-maruf-hakim-kalian-sudah-berencana']	[]	0	0	1	['kuatmaruf', 'ferdysambo', 'brigadirj', 'sidang']	[]	https://twitter.com/serambinews/status/1600071178466361344	False		0								[]				
1600060244910022661	1600060244910022661	2022-12-06 16:31:04 SE Asia Standard Time	2022-12-06	16:31:04	+0700	124839730	trans7	TRANS7		"Hakim persidangan ""sentil"" Ricky Rizal &amp; Kuat Ma'ruf. #Redaksi  https://t.co/zJiCNN5NZ3"	in	[]	[]	[]	0	2	8	['redaksi']	[]	https://twitter.com/TRANS7/status/1600060244910022661	False		1	https://pbs.twimg.com/media/FjSOSD4XgAAmauf.jpg							[]				
1600054903707439104	1600054903707439104	2022-12-06 16:09:51 SE Asia Standard Time	2022-12-06	16:09:51	+0700	18129942	tempodotco	tempo.co		"Majelis Hakim menyindir Kuat Ma'ruf dan Ricky Rizal ""buta dan tuli"" karena kompak mengaku tidak mengetahui Ferdy Sambo menembak Yosua. #TempoNasional  https://t.co/XzsCSZHuzB"	in	[]	['https://nasional.tempo.co/read/1664920/begini-reaksi-hakim-saat-ricky-rizal-dan-kuat-maruf-kompak-tak-lihat-ferdy-sambo-tembak-yosua?utm_source=Twitter&utm_medium=Audev&utm_campaign=Nasional_Syahdi']	[]	0	0	0	['temponasional']	[]	https://twitter.com/tempodotco/status/1600054903707439104	False		0								[]				
1600052180811395073	1600052180811395073	2022-12-06 15:59:02 SE Asia Standard Time	2022-12-06	15:59:02	+0700	1520998271161831424	tauberitamedia	tauberita		Ferdy Sambo minta Richard Eliezer tak libatkan Putri Candrawathi, Kuat Ma'ruf, dan Ricky Rizal. Sebab, yang tembak Brigadir J adalah Richard Eliezer   https://t.co/X3XoVrsfCl	in	[]	['https://www.tauberita.com/ferdy-sambo-ke-richard-eliezer-dia-yang-nembak-jangan-libatkan-istri-saya-kuat-dan-ricky']	[]	0	0	0	[]	[]	https://twitter.com/tauberitamedia/status/1600052180811395073	False		0								[]				
1600051427103023107	1600051427103023107	2022-12-06 15:56:02 SE Asia Standard Time	2022-12-06	15:56:02	+0700	1520998271161831424	tauberitamedia	tauberita		Ferdy Sambo minta Richard Eliezer tak libatkan Putri Candrawathi, Kuat Ma'ruf, dan Ricky Rizal. Sebab, yang tembak Brigadir J adalah Richard Eliezer   https://t.co/X3XoVrJiEl	in	[]	['https://www.tauberita.com/ferdy-sambo-ke-richard-eliezer-dia-yang-nembak-jangan-libatkan-istri-saya-kuat-dan-ricky']	[]	0	0	0	[]	[]	https://twitter.com/tauberitamedia/status/1600051427103023107	False		0								[]				
1600051333767499776	1600051333767499776	2022-12-06 15:55:40 SE Asia Standard Time	2022-12-06	15:55:40	+0700	1576197329626943488	de_liput	Kabar Nuswantara		VIDEO: Terungkap! Ricky Rizal dan Kuat Ma’ruf Dihadiahi Rp 500 Juta, Richard Eliezer Rp 1 Miliar  https://t.co/KlDPPuVirX	in	[]	['http://dlvr.it/Sdw2Ck']	[]	0	2	0	[]	[]	https://twitter.com/De_Liput/status/1600051333767499776	False		0								[]				
1600030259642269697	1600030259642269697	2022-12-06 14:31:55 SE Asia Standard Time	2022-12-06	14:31:55	+0700	18129942	tempodotco	tempo.co		"""Inilah yang saya bilang kalian sudah merencanakan ini (kesaksian) dari awal,"" ungkap hakim soal pernyataan Ricky Rizal dan Kuat Ma'ruf yang bertolak belakang dengan rekaman CCTV. #TempoNasional  https://t.co/XzsCSZHuzB"	in	[]	['https://nasional.tempo.co/read/1664920/begini-reaksi-hakim-saat-ricky-rizal-dan-kuat-maruf-kompak-tak-lihat-ferdy-sambo-tembak-yosua?utm_source=Twitter&utm_medium=Audev&utm_campaign=Nasional_Syahdi']	[]	0	0	1	['temponasional']	[]	https://twitter.com/tempodotco/status/1600030259642269697	False		0								[]				
1600029336613974017	1600029336613974017	2022-12-06 14:28:15 SE Asia Standard Time	2022-12-06	14:28:15	+0700	1340908661418283008	tribun_pku	Tribun Pekanbaru Official		Ricky Rizal danamp; Kuat Ma'ruf Tak Tahu Ferdy Sambo Tembak Brigadir J, Bharada E: Mungkin Tak Mau Bicara   https://t.co/nfjpRbFGUo	in	[]	['https://pekanbaru.tribunnews.com/2022/12/06/ricky-rizal-kuat-maruf-tak-tahu-ferdy-sambo-tembak-brigadir-j-bharada-e-mungkin-tak-mau-bicara']	[]	0	0	0	[]	[]	https://twitter.com/tribun_PKU/status/1600029336613974017	False		0								[]				
1600027835342659584	1600027835342659584	2022-12-06 14:22:17 SE Asia Standard Time	2022-12-06	14:22:17	+0700	1599895617613996034	verrstin	john verrstin		BREAKING NEWS – Sidang Pemeriksaan Saksi: Richard Eliezer, Kuat Ma'ruf dan Ricky Rizal  https://t.co/QnlIPPEz0X	in	[]	['https://newskhabri.site/breaking-news-sidang-pemeriksaan-saksi-richard-eliezer-kuat-maruf-dan-ricky-rizal/']	[]	0	0	0	[]	[]	https://twitter.com/verrstin/status/1600027835342659584	False		0								[]				
